tanggal_baca,clean_author,clean_text,like_count,id,word_count
2026-01-25 07:00:00,@priyo16,"Negara kok khawatir dengan rakyat yang pinter dan kritis?
Teori kebodohan dan kemiskinan emang dipelihara itu memang semakin menemukan pembuktian.",4,UgxCGFSrpZTWRiXUwUR4AaABAg,20
2026-01-25 07:00:00,@kererenng,"Halah masih nerima duit mdif aja, sok wkwkwk",0,UgxX__E8RWPlUgiI8194AaABAg,8
2026-01-25 07:00:00,@eman_rbeg,"Kaya mau 1000 tahun aja berkuasa ini Parabroro aneh gw, Kalau di Rubah terus besok atau Lusa dia ga berkuasa yang menikmati Kelompok lain dong 😂😂",0,UgwlW8MFPqN14vmgG4V4AaABAg,26
2026-01-25 07:00:00,@luckylukman3525,"PD 3 kapan sih, pak tram buru lah lama banget.. 😂",0,UgwTA_TkM7mpxnmOoZ54AaABAg,11
2026-01-25 07:00:00,@sunarkasunarka3714,"Gembar-gembor antek asing tapi oligarki2 negeri sendiri & pejabatnya2 seperti orang asing, kasus2 penyerobotan tanah oleh perusahaan2 sawit/tambang yg korbannya rakyat kecil yg tdk dilindungi oleh negara  😂😂",0,UgyP4edV0q0x_D8jXC54AaABAg,28
2026-01-25 07:00:00,@SoulS467,"Bikin UU baru mulu tp ga ada tuh buat kepentingan publik, otak atik teros sampe sangkakala ditiup
Nyebut antek asing malah gabung organisasi trump..padahal teritori negara deket cina, ude lobi sono sini sama cina jga",0,UgykP1X3lzJ51AnHdIN4AaABAg,35
2026-01-25 07:00:00,@mburuberkah8020,"Pemerintah sekarang semakin kesini kok semakin tidak berpihak pada Rakyat.
Sibuk membuat aturan yang berpihak pada dan untuk mempertahankan jabatan mereka.",7,UgwKNvrz2QoQ69_3VMd4AaABAg,21
2026-01-25 07:00:00,@apakansaja8505,"Anies Baswedan udah di cap sabagai AntekAsing... Biasa lah dgn WakJawa... Yg sdg berkuasa, semua omon2 nya itu betul... suara Tuhan... jgn di sangkal... 😊😊😊",0,Ugz7HLVWd8GIeczxywh4AaABAg,25
2026-01-25 07:00:00,@newsupdateok,Antek Asing sesungguhnya ya Pak Omon,26,Ugxal0n63TmeaOE_fW94AaABAg,6
2026-01-25 07:00:00,@ste4494,"Coba Donkk kalo bukan antek asing, mau donk bahas Prabowo yg baru aja merapat ke Donald Trump di Board of Peace, disaat dunia memusuhi Amerika.

Kalo berani bahas berarti tempo mantap 👍😊
Kalo nda, waduh sy jd ragu deh..😊🙏🏻😊",1,Ugxal0n63TmeaOE_fW94AaABAg.ASM1FpQ7E2wASMv6F6XdjH,39
2026-01-26 07:00:00,@ml-tan-yss,Antik asing sesungguhnya dari Yaman.,0,Ugxal0n63TmeaOE_fW94AaABAg.ASM1FpQ7E2wASP2t03MriR,5
2026-01-25 07:00:00,@dharmasusanto1356,Sense of crisis nya RENDAH ...jdlah konoha makin keruh .,6,UgzzRAsHBiR13NOguz94AaABAg,10
2026-01-25 07:00:00,@AdiliJokowi6626,Hidup Suharto!!,0,Ugxgm57Z_WUoDF-Uig94AaABAg,2
2026-01-25 07:00:00,@Bejo-xb2wl,Kim jeoung wo kapan dimadurokan ? 😎,1,UgwvH3l4eAxvAEAlNC14AaABAg,7
2026-01-25 07:00:00,@Ahmadkuryonosw,Menuju pemimpin diktator,0,UgyNWEFqTdtKsZIwQDZ4AaABAg,3
2026-01-25 07:00:00,@andhikaabierama8402,"19:46 boong lo Kang, buktinya sampe sekarang seluruh rakyat Indonesia belom tau, siapa FUFUFAFA !!",0,UgwMFydyAvWd84-rMnt4AaABAg,15
2026-01-25 07:00:00,@fendipradana6598,Pak wapres ada tanggapan 🥱😴,0,Ugwf_FRWPt3CCJcjJxR4AaABAg,5
2026-01-25 07:00:00,@HarunArrasyid-bs8vw,Terus berjuang sahabat!!!,1,UgzaLdHoUsbZjJNpTz94AaABAg,3
2026-01-25 07:00:00,@ndahmaldiniwati,"HEIIII ANTEK-ANTEK ASONG!! 
Ini hanya kisah sopir angkot tua-pemarah & tukang asong seperti cerita seorang komika 😜",0,UgzgQifG-Wg_CbtrDFV4AaABAg,17
2026-01-25 07:00:00,@yoyokpramono9503,Rezim serakah dan pelindung penjahat itu musuh rakyat bersama,0,UgwmaI23ERiwiXRXCEt4AaABAg,9
2026-01-25 07:00:00,@edmudkusuma5699,"Dia yg ""menciptakan musuh bersama"" tp kita aamiin kan biar cpt kejadian agar ada perubahan",3,UgxBIs2VsWV9Ax4zvqF4AaABAg,15
2026-01-25 07:00:00,@Kingdomofpupupapa,kalu RRC termasuk asing gak ya?...,0,Ugw_9O0mKn9zh0j93R14AaABAg,6
2026-01-25 07:00:00,@ondruzz,"Jangan menutup mata bosku , bahwa memang banyak sekali berita yang di PELINTIR di republik ini demi OLIGARKI DAN MAFIA yang piring nasi nya sudah di ambil kembali oleh republik ini .


RAPATKAN BARISAN JANGAN MUDAH PERCAYA KE PADA SIAPAPUN!!!!!!",0,UgyQDs2hXNnbKp8luSl4AaABAg,40
2026-01-25 07:00:00,@Suwitoo-zw9gi,"Pemimpin harusnya fokus ke tujuan nasional yg tercantum dalam pembukaan UUD 1945, spt politik stabil , ekonomi tumbuh positif , kesejahteraan keadilan sosial , hankam , ideologi Pancasila ,   SDM , SDA , .......",0,UgyT4aZvKEgQlU4ZtPh4AaABAg,34
2026-01-25 07:00:00,@BandengLiar,"Kembali seperti orde Baru nih, semua dibungkam. Apa kabar yang milih presiden sekarang?",0,UgyaNJt20cD6Gn4lxIx4AaABAg,13
2026-01-25 07:00:00,@donlasky,NGADEPIN ANTEK SOLO AJ GA BERES,0,UgxSuoxo3Xs8Hbw84nJ4AaABAg,6
2026-01-25 07:00:00,@agustinusmuji8588,Semoga yang komentar negatif di sini dulu bukan pemilih Prabowo .Karena era baru orde baru yang akan datang ini sudah bisa diprediksi seharusnya..,0,UgxnoO_WnR5zhlS0SsN4AaABAg,23
2026-01-25 07:00:00,@agustinusmuji8588,Selamat datang new era...era baru....orde baru ..,6,Ugxc9B5yPrLoWam1KBR4AaABAg,7
2026-01-25 07:00:00,@lausdeohendra8927,"Dgn KATA LAIN jika INGIN AMAN maka WAJIB MEMUJI PEMERINTAH DALAM HAL APAPUN !!! 
TIDAKKAH JUSTRU pemerintah harus EXTEA WAS WAS saat SEMUA PIHAK hanya MEMUJI DAN MEMUJA PEMERINTAH ???? Siapa MUSUH SEJATI nya menjadi ""KABUR"" !",0,UgyxeLdD-FywGkyW7eZ4AaABAg,37
2026-01-25 07:00:00,@looksharps,"Propaganda adalah usaha yang disengaja dan terencana untuk memengaruhi pendapat, sikap, atau perilaku masyarakat demi mencapai tujuan tertentu, biasanya tujuan politik, ideologi, atau kekuasaan. Informasi yang disampaikan sering kali bersifat selektif, tidak seimbang, dan menekankan emosi agar orang mudah terpengaruh.

Ciri-ciri propaganda:
Memiliki agenda atau kepentingan tertentu
Informasi disajikan secara sepihak atau dilebih-lebihkan
Mengandalkan emosi (takut, bangga, marah, nasionalisme, dll.)
Komunikasi satu arah
Bertujuan membujuk, bukan mendidik secara kritis

Contoh:
Iklan politik yang hanya menampilkan keberhasilan calon tertentu dan menutupi kekurangannya, sambil menjelekkan lawan politik.

Sosialisasi adalah proses panjang di mana seseorang mempelajari dan menghayati nilai, norma, kebiasaan, dan budaya yang berlaku dalam masyarakat. Tujuannya agar individu dapat hidup dan berperan sebagai anggota masyarakat yang baik.

Ciri-ciri sosialisasi:
Terjadi secara alami dan terus-menerus
Tidak bertujuan memanipulasi
Bersifat mendidik dan membentuk kepribadian
Terjadi melalui keluarga, sekolah, agama, teman, dan media
Komunikasi dua arah dan interaktif

Nah, sebagai Congor Media Soros, Kira2 kalian udah ada gambaran blm tentang Perbedaan Keduanya.

JANGAN DISAMAKAN. 

TEMPE BACEM MENTANG2 JADI MEDIA SOROS, SUKA BELAGU DEH....",4,UgywZI-lycBO4W8hoLp4AaABAg,169
2026-01-25 07:00:00,@KirekElek-w5e2y,Antek asing itu ya freeport  imf  dan kawan kawan yang memiskinkan rakyat indonesia negara indonesia,0,Ugzpar7VXQnRqjHfNcV4AaABAg,15
2026-01-25 07:00:00,@torus48,Loh lg ngapain ke davao ketemu asing2 kaya...,0,UgyDLqn0TOZPwtNGlTt4AaABAg,8
2026-01-25 07:00:00,@ondruzz,"ANTEK ASING itu untuk musuh yang tidak MENCINTAI NEGARA INI BOS ,
Karna sejak awal kemerdekaan pun ada  GOLONGAN yang tidak ingin NEGARA INI MERDEKA!!!!

Gue setuju RUU ANTEK ASING , SANGAT SETUJU!!!!!!!",0,Ugw4XtkUoph8WS-ZJLF4AaABAg,33
2026-01-25 07:00:00,@aliibrahim5538,"PAK PRABOWO 
SIAPA YANG JADI ANTEK ASING ITU 
SEBUTKAN CONTOHNYA 
JANGAN SEKEDAR OMON OMON 😂",1,UgwWNZrJUGIs1WOgKcl4AaABAg,15
2026-01-25 07:00:00,@khelyme5423,"Udah capek ama bapak itu, kambing coklatnya selalu asing",0,UgyA_3u3ahyU0TSiCqN4AaABAg,9
2026-01-25 07:00:00,@ffarga752,Bukankah antek2 Asing itu guru politiknya pak wowo,0,Ugy8qISmeLOwkdTyklt4AaABAg,8
2026-01-25 07:00:00,@yunitafir3253,Jangan percaya,0,UgxR80oi4lV774LsZD94AaABAg,2
2026-01-25 07:00:00,@givenmaruli9091,Persis kayak bapak mertua yang menjadikan PKI sebagai sebuah hantu untuk menjadi pahlawan-pahlawanan di depan rakyatnya.,1,Ugzn9DiHc2wA26VAfAF4AaABAg,16
2026-01-25 07:00:00,@FirdausSyair,Tempo yg di biayain oleh Soros..adalah Antek Asing yg suka bikin Narasi. Fitnah. Mengadu domba supaya negri ini gaduh dan kacau.,0,UgzAG1pXRBn9wi_OmiV4AaABAg,21
2026-01-25 07:00:00,@bergas975,"Semoga TEMPO bkn antek asing. 
Jgn lupakan sejarah indo, mulai dari zaman voc sampai PD II, siapa yg bermain, antek asing dan para penjilat.
Emang indo merdeka ,pejabat kita waktu itu setuju semua, tdk brooo. Sama juga skg, indo ingin berdikari, banyak musuhnya, asing dan pejabat penjilat",0,UgwZyCuTdQNDze4i9N54AaABAg,47
2026-01-25 07:00:00,@wargasipil6228,dirinya sendiri lupa bahwa dia antek sawit 😊,0,Ugy_pBnBfYl8yl43hMB4AaABAg,8
2026-01-25 07:00:00,@yohanaphilipus6054,"Dia sendiri kabur ke Yordania waktu itu, negara asing",0,Ugy_pBnBfYl8yl43hMB4AaABAg.ASM-G-8lTnwASME1Wv3aHZ,9
2026-01-25 07:00:00,@muhamadsahiddin6756,"“Man’s greatest battles are not with others, but with himself.”
— James Allen",15,UgxphYYnW1cj7xcG8NJ4AaABAg,13
2026-01-25 07:00:00,@ardaniayasara7875,GASLIGHTING dan MANIPULTIV…..,0,UgxBDz3ygWeqebG50Z94AaABAg,3
2026-01-25 07:00:00,@sajdahfitrianto4113,Delusional orang sepuh,1,UgyfUWSnKs2NpyVVcBt4AaABAg,3
2026-01-25 07:00:00,@hazibribieq,"11:09 pratikno, ci? 😭",0,Ugy3BbBjdBMAtDQ6KYJ4AaABAg,4
2026-01-25 07:00:00,@MuhammadFajar-ls5ly,musuh utama itu dari dalam,0,Ugy5sV0OOQNgUH_5odJ4AaABAg,5
2026-01-25 07:00:00,@Agustawankarnajaya,Sangat antisifatif dan demokratis Iran tangkal kekacauan setelah 302 WN ditangkap dan menggantung  sel² agen asing setelah sidang singkat.Iran kembali aman,0,Ugze83WewY6hPQO5Gzx4AaABAg,21
2026-01-25 07:00:00,@relaxandfocus6608,Halu tingkat tinggi,0,UgweGtfe7Xyfqson8HJ4AaABAg,3
2026-01-25 07:00:00,@tuahutabarat2404,Saya speechless,2,UgyZXaH0E07XtSPHSst4AaABAg,2
2026-01-25 07:00:00,@budihariyono9789,"Mungkin mau dibikin seperti china.., narasinya biar gampang jadi negara maju.., masalahnya mental pejabatnya bagaimana???",0,UgzW0Y4j5VD0IDERLI54AaABAg,15
2026-01-25 07:00:00,@kiky.12,"Ga butuh bantuan asing untuk saudara2 di Sumatera yang kena bencana, tapi malah hambur2in duit 17 T buat ikut klubnya Trump. Kan jadinya siapa tuh yang aseng?",0,UgyTRJieFcGAeC-7bAh4AaABAg,27
2026-01-25 07:00:00,@achungaroon8570,Gak sadar anteknya ada lingkarannya sendiri.,5,UgzjPLbAIp-GPMQh1eN4AaABAg,6
2026-01-25 07:00:00,@alexsalapan6329,"4:18 Menurut KEYAKINAN SAYA, saat itu mungkin GIBRAN lagi NGANTUK
😂😂😂",0,UgwVHf6NEYBr8AYLenJ4AaABAg,11
2026-01-25 07:00:00,@BMRMtv,Yang ANTEK ASING adalah yang menjadi backing TKA China dan melindungi penjarahan KEKAYAAN ALAM INDONESIA di Morowali dll.,2,UgxIqLG_wfRT5p-LhHR4AaABAg,18
2026-01-25 07:00:00,@yohanaphilipus6054,Benar sekali. Mulyono kah itu ?😅,1,UgxIqLG_wfRT5p-LhHR4AaABAg.ASLz45OIolUASMCNldM4kF,6
2026-01-25 07:00:00,@pikpeter2400,Ada aja gebrakan konyol wowo dan kabinetnya,0,UgzYNCkGVOdV5bqpZFZ4AaABAg,7
2026-01-25 07:00:00,@looksharps,"Coba bahas dong tentang Propaganda Asing. 
Kalau emang kalian berkepentingan utk utuh dan baiknya kehidupan bangsa ini.",0,UgxZjmvUc68_sdtG-_N4AaABAg,17
2026-01-25 07:00:00,@PutriRàhma-l2o,"Rakyat bersuara kritis karna pemerintah.DPR.DN OKNUM JENDRAL""TNI.POLISI DN PR PENSIUNAN JENDRAL KORUP.GARONG KEKAYAAN ALAM..KEADILAN TDK ADA..Rakyat di miskinkan di bodoh kan terus..musuh rakyat pemerintah sendiri bukan aseng..",3,Ugyr0EBZXSwd-0Gw3M14AaABAg,27
2026-01-25 07:00:00,@wahyuwidayat72,"teriak teriak asing,aseng... harusnya sadar, musuh kita adalah pejabat pejabat/institusi negara kita sendiri yg banyak korupsi, menyalah gunakan wewenang, suap menyuap dan kinerja tdk benar...",9,UgxNWDJFmUIM-N7OuqF4AaABAg,25
2026-01-25 07:00:00,@anzhoshaaktar,"Kabinet Belanga Kosong……, pretttttt!!!😂😂😂",0,UgzNFeRQkWKU-mbOuot4AaABAg,4
2026-01-25 07:00:00,@habibpamungkas3503,Sekali2 kalian bahas infrastruktur hancur di daerah. Yang terdampak program populis prabowo,0,UgxQZ1Kd4WXQ9_8ihdB4AaABAg,12
2026-01-25 07:00:00,@ratragm2122,Fufufafa ngertinya mainan,0,UgyQRbNBOdqv4GnQ6Np4AaABAg,3
2026-01-25 07:00:00,@dikdiksenja5575,"Ancaman bukan dari antek asing, tapi dari bangsa sendiri krn ulah Rezim pejabat politikus sendiri !!!",8,Ugzr6crwsM7W1J-ZErJ4AaABAg,16
2026-01-25 07:00:00,@marlinayan,Antek asing sering di jadikan penyebab masalah di dlm negeri. Tp suka banget berkunjung ke negara antek asing.,29,UgxmyuCNLZycWQgxOul4AaABAg,18
2026-01-25 07:00:00,@heruyudiantosby7782,"bahkan bergabung dgn trumph, somplak tenan",2,UgxmyuCNLZycWQgxOul4AaABAg.ASLyaDPTSNrASMXYsFC1wE,6
2026-01-25 07:00:00,@R1O595,"Dia tau caranya 😅
Sama spt kasus Presiden PKS Lutfi Hasan kasus impor daging sapi yg mengatakan ulah yahudi padahal terbukti dia yg korupsi 😂😂. 
Ciptakan musuh bersama utk mengaburkan 😂
Dan anehnya warga konoha percaya 58℅ 😂😂",10,Ugw6WeOLagTt_eKWcpp4AaABAg,38
2026-01-25 07:00:00,@looksharps,"Cie... Cie... 
Sebagai antek Soros, ketar-ketir dia. 
😆",0,UgwErRWVbj-SLCS8IR14AaABAg,8
2026-01-25 07:00:00,@putriantiyuiana,"bilang antek asing  tapi selalu datang ke negara asing,memang orang munafik",0,UgzVKVRGZ4Pb0XSEBvh4AaABAg,11
2026-01-25 07:00:00,@aldopasto,Orde paling baru,1,UgzeBy5gRg3fnGsGLQd4AaABAg,3
2026-01-25 07:00:00,@mozznugo,padahal dia yang antek asing...halan2 terussss,0,UgzdzhBp00pOE_1mtQp4AaABAg,6
2026-01-25 07:00:00,@wildanwildani2149,Orde Baru gaya baru,2,Ugw8JNsN0waTeSD29a14AaABAg,4
2026-01-25 07:00:00,@robertpanjaitan2263,Ujung2nya menyalahkan rakyat juga. Contoh Bahlil masalah listrik di daerah bencana lapor ke Presiden propaganda bukan..? UU banyak tapi tidak dilaksanakan..!,0,UgzwGrh3Vf0IHBTBVH94AaABAg,21
2026-01-25 07:00:00,@ariepilot3353,Ini sama dengan narasi subversi jaman ORBA 🤔,4,UgyKfDGUl4JDmOtfsDd4AaABAg,8
2026-01-25 07:00:00,@diyanidjanwir6057,"Halah antek asing. Lah dia halan2 ke LN melulu, presiden dg kunjungan LN terbanyak padahal br 1 th. Di dlm negeri msh berantakan. Memperkenalkan prabowonomics yg blum teruji keberjasilannya dlm mensejahterakan rakyat. Welcome PMA beh...",7,UgzYluTYa8ry9BbdHYN4AaABAg,35
2026-01-25 07:00:00,@m.isamario3214,Bukannya dia baru gabung kubu antek asing board of peace😂😂😂,0,UgysYzX9-H0ionDdOlt4AaABAg,10
2026-01-25 07:00:00,@UttyChan,"Anak presiden Prabowo hidup lama dan sekolah di eropa 
Pulang ke Indonesia kala bapak nya jadi presiden 😢",5,UgwjdMGz55qgq3laIWR4AaABAg,18
2026-01-25 07:00:00,@suburmakmur4324,Yang berasa di YouTube buzzer Jiran sih,0,Ugx3Y7rYV6aSCC76xNx4AaABAg,7
2026-01-25 07:00:00,@taufikrahman3930,Dikit-dikit tuduh antek.. eh ternyata antek Trump,0,Ugz256PL8RWVGgjrvdh4AaABAg,7
2026-01-25 07:00:00,@iyogorotna4677,"Wkwkwk ,....propaganda asing ...kok gak sadar selama ini sudah banya propaganda asing dg topeng  surga dan neraka ...haram dan halal ....yaitu agama  dari asing ......... wkwkwkwk😂😂😂😂😂😂😂😂",0,UgybDkstpmLG9-YBcZN4AaABAg,26
2026-01-25 07:00:00,@yudialaksamana433,Antek asing ada di sekitar Prabowo sendiri,6,Ugy86Lwfc40RTV49gpF4AaABAg,7
2026-01-26 07:00:00,@ml-tan-yss,Si radikal.,0,Ugy86Lwfc40RTV49gpF4AaABAg.ASLxhwd-BRpASP2mSMmDhf,2
2026-01-25 07:00:00,@muhamadakbarakbar8197,semoga pak probowo dilindungi Allah swt,0,UgwyVvQJNTNrqxWLnyp4AaABAg,6
2026-01-25 07:00:00,@AliefHidayatulloh-x8f,Wkwkkwkw dia mah udah banyak duit gausah lu pikirin. Lu yg susah pikirin aja diri sendiri. Anggaran aja dipake serampangan bukan buat kesehahteraan rakyat,1,UgwyVvQJNTNrqxWLnyp4AaABAg.ASLxVkRLlX8ASLzFRwMeNH,24
2026-01-25 07:00:00,@Seputarsepakbola111,Media jembut 😄😄😄,0,UgwNI_QyN2tNlCdqAMZ4AaABAg,3
2026-01-25 07:00:00,@antonov5428,"Antek asing dan propaganda asing itu nyata, Salah satu contohnya adalah antek George Soros 😂😂😂",0,UgxkKyubh4gZMlrgF6V4AaABAg,15
2026-01-25 07:00:00,@harrissuherman350,"Prabowo anteknya trump, dia ngemis2 mau ketemu anaknya trump",0,UgxkKyubh4gZMlrgF6V4AaABAg.ASLxReVHjZ0ASM49-yxokp,9
2026-01-25 07:00:00,@yatiyati6717,Mb cici koq tiba2 udah langsing ajah nih,0,UgxdqndYCbxHL1xmSeN4AaABAg,8
2026-01-25 07:00:00,@m.solikulhadi,selalu ada cara untuk mempertahankan kekuasaannya,5,UgyOm7rpjSfRzkOw44l4AaABAg,6
2026-01-25 07:00:00,@noname_45566,Bahas kepala daerah dipilih dpr nextnya,0,UgxUwk-f8nV46kUAQ_V4AaABAg,6
2026-01-25 07:00:00,@rukiyanto5217,negara makin rusak wok,0,UgxG-NcQN_zztE7_dwp4AaABAg,4
2026-01-25 07:00:00,@geopolitik-dunia,"Pertama, ancaman asing itu memang ada, kedua perlu bukti apabila ancaman asing itu memang ada. Jangan sampai kayak Iran dan negara-negara serupa lainnya yg memanfaatkan pihak asing sebagai kambing hitam atas ketidakmampuan mereka mengurus negara. Padahal di dalam negara mereka, banyak kasus yg perlu dibenahi yg merugikan negara, mulai dari korupsi, pemberdayaan ekonomi yg tidak jalan, sistem pendidikan yg tidak benar, penempatan tenaga ahli yg tidak benar (misalnya menteri pendidikan bukan dari kalangan ahli pendidikan tapi dari diisi orang-orang berdasarkan politik balas budi), dsb. Sekali lagi, antek asing memang kemungkinan ada, tapi sejauh mana antek asing mempengaruhi perkembangan atau kemajuan negara? Kalau memang ada bukti ya tangkap saja, jangan cuma omon-omon asal buktinya kuat.",0,UgzTzLFoRTZFR8tdh2d4AaABAg,114
2026-01-25 07:00:00,@younoeoeno8943,"Parah negeri tambah kacau,dipegang SM pemimpin  yg  anti kritik
.",6,UgyBXvPKE9HNohxRR_54AaABAg,10
2026-01-25 07:00:00,@zukhorizukhori1957,Trmksh ats pencerahannya,0,UgwLu7oAKq0Z0mJH0rt4AaABAg,3
2026-01-25 07:00:00,@papakhay9714,"Yang buat negara ga maju itu bukan propaganda asing, tapi pejabat yang korup. Bukan ditanggulangi dgn baik malah diberi potong tahanan, contoh negara yang membenahi dgn baik sudah ada cina dgn hukuman mati bagi pejabat koruptor.

Itu kalo bener2 mau negara ini maju, bukan cuma omon2 dan malah nyalahin propaganda negara lain.",0,UgyIz-7VSvd56dXVlvZ4AaABAg,52
2026-01-25 07:00:00,@Ki_Ageng_Spirit,"Ini arahx spt TIRANI.
Tanpa disadari, Propaganda SIMON(SI oMON2) mulai bersemi.

Awalx memperkuat militer skaligus loyalitas mreka pd dirix(SIMON), berlanjut melumpuhkan polisi dgn 'MENYANDERA' Kepalax.
Kejaksaan pun DICENGKRAMx.

Slanjutx menumbuhkan KEBENCIAN kepihak ASING kpd rakyat, sementara disatu sisi, SIMON berlengGANG pingGANG dipangGUNG internasional dgn lobi2 tuk MENCITRAKAN dirix laikx seorg Flamboyan.",0,UgzLyu6jgNC8ubo1MaB4AaABAg,51
2026-01-25 07:00:00,@ZulvedeIsmal,Antek asing itu adalah sekelompok warga negara sipit yg menguasai hampir seluruh sumber SDA di negara kepulauan ini Wei 🤭😊,0,Ugxmwn37s5EMY2D2y0Z4AaABAg,20
2026-01-25 07:00:00,@konsepiturelative9119,Sepuh selalu pikun ?,0,Ugx1jHuD4wlOzfZziKN4AaABAg,4
2026-01-25 07:00:00,@LoneWolf_729,Teriak antek asing tapi justru join board of peace nya Trump mana joinnya mbayar lagi wkwkw kocak 😂😂🤣🤣,0,UgyNZOlokyqR-sNtDFB4AaABAg,18
2026-01-25 07:00:00,@markonahleyes2701,"Beneran fasis nih jendmon. Kenapa? Krn 58% org yg memilih itu terpaksa jd jendmon insecure sendiri. Pdhal dia sendiri si antek asing, buktinya nyata 😢",2,UgyLGNtuU4KUmMsmtDF4AaABAg,25
2026-01-25 07:00:00,@ProbomutyaKaka,Kok teringat mantan mertua nya Suharto yg berbeda atau kritik Suharto dilabel PKI.......,5,UgzcedfXsrUWCMGFeEB4AaABAg,13
2026-01-25 07:00:00,@meymey2411,"Pak Prabowo hanya PHP pada rakyat/hanya OMON OMON,, kalau serius memberantas antek asing itu sangat mudah,, geng Solo adalah markas antek asing.",0,Ugz4Y5rau7lUr0JhVe94AaABAg,22
2026-01-25 07:00:00,@sandyaryanto1977,K-Pop propaganda jg,0,UgwOyJpKA0m8zh8HREh4AaABAg,3
2026-01-25 07:00:00,@lusianarose,Halo Antek-antek Asing.. 🤣🤣🤣,0,UgwqZrgHlv0fa3Do2S94AaABAg,4
2026-01-25 07:00:00,@JoyGale-j1r,Buzzer harusnya yg di take down karena  Memecah belah dan memprovokasi,0,Ugw-B83VyTifgAa5PGx4AaABAg,11
2026-01-25 07:00:00,@paulsoegiarto6785,Yang buat propaganda ya si Wowo sendiri.,0,UgxsygYHHuWh30DZhaF4AaABAg,7
2026-01-25 07:00:00,@Syaharmansulthan9371,"Di negeri ini, musuh sudah ditetapkan: Amerika Serikat dan antek asing. Mereka jawaban instan atas kemiskinan, hukum yang dijual, dan aparat pemalak. Segala kebusukan lokal dibungkus rapi, lalu dilempar jauh ke luar negeri.
Musuh jauh diramaikan, penindas dekat disucikan. Yang lantang mengutuk justru paling alergi diaudit. Yang berteriak kedaulatan paling takut transparansi. Label “antek” ditempel pada siapa pun yang bertanya terlalu dekat.
Rakyat diarahkan membenci bayangan agar lupa pada tangan yang menekan leher. Kebencian dikelola agar kekuasaan aman dari pertanggungjawaban.
Akhirnya, musuh bukan ditentukan oleh siapa yang menyakiti rakyat,
melainkan oleh siapa yang paling aman untuk dibenci.",6,UgwjIe0HBaUGh4Qt_Zl4AaABAg,97
2026-01-25 07:00:00,@metasuroto9102,Percuma selama Abdi negara hanya memikirkan diri sendiri dan keluarga....apalagi etika dan moralitas yang sudah sampai ketahap... Menjadi keluarga yang ber DNA Penghianat...... Jika khianat dianggap hal biasa maka  bangsa tersebut sudah  diambang kehancuran  negara di gadaikan hanya demi mempertahan kekuasaan  dan memelihara relawan  dan memenjarakan  yang bersebrangan ....😂😂😂😂,0,UgwpfKZevYcheMMnuBt4AaABAg,49
2026-01-25 07:00:00,@normanbates5670,"Jaman Hitler tidak Ada social media.
Propagandanya dilakukan lewat radio, pamflet, spanduk, dan selebaran yang dibagi-bagikan ke tiap orang.
Se-simpel itu",0,Ugws8uXEaVn3J_PD_9F4AaABAg,21
2026-01-25 07:00:00,@erwanagus2639,Musuh bersama & utama bangsa Indonesia adalah korupsi bukan antek asing...,4,UgyOlJHYYpfnFkdhb9h4AaABAg,11
2026-01-28 07:00:00,@KutuKhan6467,"oi, aseng itu tdk akuntable 😩 y otomatis korup,",0,UgyOlJHYYpfnFkdhb9h4AaABAg.ASLwA82KegDASU2oU_d-7J,9
2026-01-25 07:00:00,@alsetyaalsetya1560,Otoriter baru telah lahir,0,UgxQZS97L8Cl18o0TCV4AaABAg,4
2026-01-25 07:00:00,@cerita-menarik,"Antek asing itu yg sering ngomong "" Yess Sier, yessss siiieerr ""..??",0,UgxWjOFid35ZyZbHZZx4AaABAg,12
2026-01-25 07:00:00,@firmanbudianapengestu4462,"Saat framing "" antek asing "" diputar berulang2 sampe kusut  buat menutupi apa yg seharusnya dibenahi",2,Ugwwt6jWzDlNH6t81-J4AaABAg,16
2026-01-25 07:00:00,@meymey2411,"Sebagai komando jadi antek asing bukankah presiden ke 7 ,, karena sejak Jokowi jadi presiden semua proyek dan tambang semua berhubungan dengan China,, bahkan tambang nikel negara sampai malah rugi 10% kata Faisal Basri, bukankah itu sangat biadab???, pak Prabowo kami anggap hanya OMON OMON,, kalau pak Prabowo serius memberantas antek asing itu sangat mudah karena beliau orang yg berkuasa saat, tapi mengapa sebagai presiden pak Prabowo kok tak punya nyali di geng Solo,, padahal mereka itulah antek asing yang sebenarnya.",0,Ugww5O9HvK5kSGSchHN4AaABAg,81
2026-01-25 07:00:00,@houseprediction2834,Padahal dia sendiri antek asing 😂,3,Ugz2yHRp8U1Um_E1wUp4AaABAg,6
2026-01-25 07:00:00,@sandyaryanto1977,Negara mna yg ingin Indonesia maju sya kira ngk ada,0,Ugz2GDjkuO2iPXjzC454AaABAg,10
2026-01-28 07:00:00,@dennymuabuay9620,PS tdk pernah berkunjung rutin ke daerah(Propinsi) di indonesia,0,Ugz2GDjkuO2iPXjzC454AaABAg.ASLvrWurMqTASSqvoTq2wK,9
2026-01-25 07:00:00,@agusastraatmadja8171,Jualan ketakutan ke rakyat... 😄,0,UgzUb8koN5sATXIZ0YJ4AaABAg,5
2026-01-25 07:00:00,@sah7785,"Salah satunya majalah TEMPE...
Titipan Jorge Soros.. Amerika & Israel
😜",0,Ugww9p0AKinXZ5CEosh4AaABAg,11
2026-01-25 07:00:00,@ferrykelvin,"Akun FUFUFAFA...sampe sekarang masih ABU ABU itu akun MILIK SIAPA..🤭🤭🤭🤭🤭
Apa harus NUNGGU LENGSER si pemilik AKUN FUFUFAFA...🤭🤭🤭🤭🤭
"" BAKSO..BAKSOO...""",0,UgyHJaGtZvlBQV1cTb14AaABAg,20
2026-01-25 07:00:00,@UnitedSatans,Antek antek asing adalah propaganda mengibuli rakyat terus menerus spy jgn kritik doraomon,0,Ugyw2Mn3DDVHdCQvP-V4AaABAg,13
2026-01-25 07:00:00,@mukalukayakanjing,"Keukeuh antek asing😂 Kayak bapak bapak dari pedalaman yang gampang kemakan konspirasi😅 giliran ada case kayak PT IMIP lu pada diem seribu kata. Kalo ga ada niat jahat nya disitu berarti pengecut. Clear kan?
Jan banyak bacot, kerja aja yang bener. Progress hanya terjadi ketika dikerjakan dengan benar.",0,UgwYpxmFXIprxxI3K-x4AaABAg,48
2026-01-25 07:00:00,@setrodimedjoe634,Si omon omon😅😅😅,0,UgyMBEXpTYVuJhLtcWN4AaABAg,3
2026-01-25 07:00:00,@hwangismine9818,Padahal yg kelakuannya antek2 asing dia sendiri. Lol!,0,UgzqSZI4wfylvwTZGFB4AaABAg,8
2026-01-25 07:00:00,@blankpage8766,"Ga apa-apa menjadi antek asing dengan influence barat untuk menyuarakan demokrasi yang lebih baik dari pada berlindung pada propaganda nasionalisme busuk yang sarat dengan militeristik & korup, dengan kembali menyusupkan glorifikasu orba pada politik hari ini..",0,UgzBsRea31hvKPFccMN4AaABAg,36
2026-01-25 07:00:00,@AnggoroHendry,"Setuju, biar berita itu isinya fakta semua, bukan cuma gorengan isu doang",0,UgwfPAwGLZxfi8DAdo94AaABAg,12
2026-01-25 07:00:00,@Integrityisrare,Jelas sudah Prabowo menjalankan pemerintahan rasa orba seperti Suharto dulu. Anggaran negara digunakan ugal2an dan pembukaman sana sini.,20,UgyIXt1hCRfW8F7a3yx4AaABAg,18
2026-01-27 07:00:00,@serbaserbi666,Orba pun sungkem.malah terkesan seperti nubi kalau di bandingkan.,1,UgyIXt1hCRfW8F7a3yx4AaABAg.ASLulwROCK4ASQeFHCJ0cm,9
2026-01-25 07:00:00,@kobatheape794,Gw bilang mah koruptor dan antek2 koruptor di pemerintahan lebih bahaya dr antek asing....,1,Ugw4ek3jguJ-2WgGVyF4AaABAg,14
2026-01-25 07:00:00,@yohanaphilipus6054,Setuju. Dan yg juga sangat berbahaya adalah ijazah palsu !,0,Ugw4ek3jguJ-2WgGVyF4AaABAg.ASLui_PHSqpASMD_C1_Rxw,10
2026-01-25 07:00:00,@henrysetioadi,Antek asing: cara antek asbun membuat musuh bersama...maksud judulnya ini ya?,0,UgxBLAqKfUCFht6C-9x4AaABAg,11
2026-01-25 07:00:00,@jankhim3966,"Antek asing antek aseng, tapi saat kabur ke antek asing juga,hutang ke antek asing juga,cari investor dari antek asing aseng juga,bearti manusia munafik dong,padahal antek dalam selimut sendiri paling berbahaya",0,UgzRNOjPZqb8J9AVL1l4AaABAg,30
2026-01-25 07:00:00,@afrimedia2012,"""ANTEK ASING"" NASIONALISME SEMPIT dari orang berotak kerdil, musuh bersama itu korup, kemiskinan dan kebodohan, salah satunya contoh musuh bersama WAPRES DUNG-U.",0,UgwPwXJ4fcszpQ1Vz2J4AaABAg,22
2026-01-25 07:00:00,@Rendys78,"Antek asing, tapi jalan jalan ke asing terus hadeeeh😅😅😅😅",0,UgykLPXL9l3BemTUZFp4AaABAg,9
