tanggal_baca,clean_author,clean_text,like_count,id,word_count
2026-02-01 00:37:00,@okkymahardika4502,Osang Asing Osang Asing. Lebih Baik Makan Oseng-Oseng Aja. Enak. 😁 Ha Ha Ha Ha Ha Ha,0,UgwJBQoqBYOUx9eXiXl4AaABAg,17
2026-02-01 00:36:00,@okkymahardika4502,Lupa Apa Pikun ?,0,Ugx7cZ0WLmkm4MDSRL54AaABAg,4
2026-02-01 00:28:00,@okkymahardika4502,YO,0,UgyuCla61YcmH2KIFmN4AaABAg,1
2026-02-01 00:00:00,@gregtriplex5878,Tempo itu sejak sidney jones itu udah jelas bgt kontem propaganda asing. bocah CSIS jg banyak disitu. institat institut krisis center. forum studi agen perubahan regime change agenda. nah ini gromboloannya tempo,0,Ugw3wcI-_lbARyc6uyt4AaABAg,32
2026-01-31 22:00:00,@taufan322,Inilah yang terjadi kalau segala sesuatu diselesaikan dengan cuci tangan. Harga diri orang digantikan dengan materi. Inilah bukti kalau ga semua persoalan bisa rampung dengan sogokan.,0,Ugzc9xNck1ZsmbC7l6h4AaABAg,26
2026-01-31 18:00:00,@Darwis7194,Cangkeme owo efisiensi tapi kelakuane borosisasi,0,UgwgtlWzYRkgyuvfKBx4AaABAg,6
2026-01-31 15:00:00,@CarcieNewbie,"gak ngerti maksudnya antek asing gimana..
bukanya presidenya yang antek asing yaa???bener gak sih???",0,UgziyKTliaHyzQLJ4a14AaABAg,14
2026-01-31 13:00:00,@omon2gemoy,"Si pikun inilah sesungguhnya antek2 asing, omon2 lansia",0,Ugzps09iwRHI8moYp-B4AaABAg,8
2026-01-31 13:00:00,@seansh8485,"Intinya kalo tempo sebagai profesional jurnalisme, ketika hanya memberitakan narasi yang mengkritik pemerintah, tetapi tidak pernah cover both side memberitakan narasi kebijakan yang bagus dr pemerintah (disini ditangaapi oleh nara sumbernya, ,kenapa mereka ga d(didatangi) atau di kasih data.  terkesan tempo hanya memberitakan hanya ketika ada yang support (bayar?) , everything just pure business belum tentu sebuah objektif produk profesionl jurnalisme yang di beritakan... tempo spt organisasi lainnya, hanyalah tempat orang mencari makan...",0,UgyYU9mQBxfUr6e8_614AaABAg,73
2026-01-31 13:00:00,@rizkiaw1629,"situasi skrng berbeda, jika tidak bermain politik external negara, posisi indonesia dalam zona merah, apakah kita siap untuk di serang negara lain ...",0,Ugxal1_snTH9Ih6eSyJ4AaABAg,23
2026-01-31 11:00:00,@fadlikurniawan5122,Boleh gak saya sebagai petani (cabai) millenial menganggap Pemerintah (khususnya Mentri Pertanian) sebagai musuh bersama petani Cabai... Ketika harga cabai sedikit naik langsung melakukan intervensi pasar namun harga2 obat2 dna pupuk yang melambung tinggi tidak pernah di intervensi harganya,0,UgwMCkka0IH4lHUFced4AaABAg,39
2026-01-31 11:00:00,@ahmadhartono4246,"Lah Prabowo brp kali k Negara Asing, trs ujung2x NYUMBANG 17 Trilyun k Negara Asing  ?????",0,Ugyv8zSSabXL2mLg3I14AaABAg,16
2026-01-31 11:00:00,@TheDragonian,lah iya media yg punyanya George Soros siapa ya????? warga Indonesia jgn mau dihasutt,0,UgxnyPKN0l8czP6jg6B4AaABAg,14
2026-01-31 08:00:00,@nurmansantosa8549,2030 siap membubarkan indonesia 😂😂,0,UgxrQ7YMidXWCMTr1VZ4AaABAg,5
2026-01-31 08:00:00,@nurmansantosa8549,maklum wapres kita memahami akan ketidak pahamannya,0,Ugx3_fl7sWVq83stsKB4AaABAg,7
2026-01-31 08:00:00,@MienManik,Yang jelas..ANTEK ASING itu..bukan Rakyat..Dia yg Koar2.. tapi dia jugalah yg patut di curigai .,0,Ugx9ARrha-LALdrjIIF4AaABAg,15
2026-01-31 04:00:00,@teguhpratikto3315,"Antek asing?😅 kekayaan alam negara di depan mata itu udah dikuasai asing😅... anteknya? Lha itu disekeliling mu. Justru masyarakat yg butuh UU untuk membersihkan pejabat pemerintah dari kepentingan asing yg merusak alam dan tatanan hidup masyarakat. Dan menurut keyakinan saya justru pejabatnya yg ngajarin asing untuk bisa ""main"" di indonesia😁",0,UgyumBPGTp9ZLIueGol4AaABAg,50
2026-01-31 07:00:00,@dannnsyak,Sekarang dia gabung sm Pembantai penhjshat sisetanyshu dan Donal bebekl😢,0,UgzUqZzxxuJBfELrXfB4AaABAg,10
2026-01-31 07:00:00,@gimanbudiono6167,"Antek asing..antek asing....hooy ada antek asing, itu propaganda siapa sih...sepertinya sering disuarakan orang yg takut sama pemimpin  asing saat ketemu langsung...Sampai sedih sebagai anak bangsa dengar nya saat dia manggil presiden lain dengan kata ""Sir""..Huh banyak omon kamu.",0,Ugxx_QufljJivtxpxe14AaABAg,38
2026-01-31 07:00:00,@Ansyari4960,"sepakat antek asing itu adalah musuh bersama, tapi membuat undang undang penanggulangan anter asing itu tidak perlu kali...sebab itu bisa dipakai oleh siapa yg berkuasa untuk membungkam kebebasan berbicara dan berpendapat yg ujungnya membunuh demokrasi itu sendiri. biarkan informasi itu berkembang bebas, kan pemerintah ada intelijen untuk menanggulangi adanya pergerakan antek2 asing itu. yg terpenting itu pemerintah menjalankan  aturan yang berlaku  dan menempatkan hukum sebagai panglima tertinggi dlm bernegara dan itu bisa dipastikan rakyat akan mendukung dan hidup damai walau masih hidup dlm kekurangan.",0,UgyuAHwoBXDMp4YYBjZ4AaABAg,84
2026-01-31 07:00:00,@RuliAlexander-m9y,"Propaganda itu dilakukan oleh negara asing, menerut hemat saya upaya untuk menghadirkan undang"" itu perlu untuk menghadapi mereka, tentunya undang"" itu untuk konter propaganda asing",0,UgwTbpu0KAKBlMpfatl4AaABAg,25
2026-01-31 07:00:00,@ygnong,Video negara lain tgl 6Januari2026 di Hambalang itu Georgia/Moldova yg masih besar pengaruh/campur-tangan rezim Rusia yg Otoriter menghambat negara di Eropa Timur bergabung ke EU ?,0,UgyCiO_AEQTR21tvL1l4AaABAg,26
2026-01-31 07:00:00,@darthmeowder,"Bukan Tempo yg menjelek2kan pemerintah, tapi pemerintah yg menjelek2kan diri mereka sendiri. Ini menurut keyakinan saya.",0,UgzxbiimhOGHEMyDpVB4AaABAg,16
2026-01-31 07:00:00,@Ardi364,"Presiden Prabowo keliru mengidentifikasi musuh, masa rakyatnya sendiri dijadikan musuh ? Sungguh absurd. 🗿",0,UgxmnrrCcf8dl9y-KLl4AaABAg,14
2026-01-31 07:00:00,@iqbalfikri2689,"Presiden yang pandainya hanya omon - omon kosong ...
Tubuhnyapun sudah menunjukkan: ""Otong kosong nyaring bunyinya ...""",0,UgwN7K5q8pXtvXjshzp4AaABAg,17
2026-01-31 07:00:00,@mulyasaadi6106,Nyawit sekali memang. 😒,0,UgwQDod_O5YIArkeT694AaABAg,4
2026-01-31 07:00:00,@ariadwipangga-h7q,"Salam Bahagia 😊 
Enakan berteman dengan VOC daripada antek asing 🤫🤭😲😳😁🙏",1,UgxmMq7Gw5yllzT44fd4AaABAg,11
2026-01-31 07:00:00,@widamandhaganugraha6140,NPD,0,Ugy6ME0uOZIEKcoy8qd4AaABAg,1
2026-01-31 07:00:00,@katakrentong,Setahuku yea inilah yang pro AN AS.,0,UgzEyGYFJB0QzU1P2e54AaABAg,7
2026-01-31 07:00:00,@mujomuhammadjabyatim,Prosedur masuk nya Imigran Yaman ke Indonesia juga perlu diperiksa surat2 nya.,0,UgyCnjd7HftOGQ3ycjp4AaABAg,12
2026-01-30 07:00:00,@FARRENWAR,"antek asing antek aseeng, lu kali wo yang antek asing wkookwowkoko, suka2 lu dah",0,Ugya51n9aD0Fs1P_54p4AaABAg,14
2026-01-30 07:00:00,@YanfarakhanPoppo,"Semoga saja jika makin banyak warga negara asing yg suka atau menjadikan Indonesia sebagai pilhan negara yg favorit untuk didatangi, kita memang bisa merasa bangga, tapi juga tidak terlena dgn fenomena tsb ( yg bisa lupa / tidak waspada dgn situasi) karna baru saja ada berita tentang tertangkap nya imigran seorang pria Rumania di Bali karna dia telah jadi buronan di seantero Eropah terkait kasus perampasan sadis dan pembunuhan berencana bersama dgn teman nya dua orang yg sdh lebih dulu tertangkap di Irlandia dan Skotlandia, Akupun salut dgn kesigapan aparat intelijen kita, Terbayang kalau pelaku kriminal tsb bisa lama luntang lantung di NKRI karna bisa saja dia nekat melibatkan penduduk kita kembali berbuat kejahatan...",0,UgzT5LS4foH1ly3Kd_p4AaABAg,114
2026-01-30 07:00:00,@IvoM-f6b,"Teriak2 sikat antek asing, pada saat yang sama menjilat asing. Kenapa harus bermuka dua...",0,Ugxx0e7vao5GEn9Wo8l4AaABAg,14
2026-01-30 07:00:00,@randisuwardin6478,"gimana ya cara ngasih tahu teman"" bahwa pilihan politik itu mempengaruhi hidup, sempet kesel denger siapapun pemerintahnya hidup gini"" aja",0,UgxxV4DQAZ0jdZXcPaN4AaABAg,20
2026-01-30 07:00:00,@agusbintoro8684,Jadi narasi at propaganda asing dilakukan secara sadar at tidak sadar dapat merusak suatu negara dari dalam. Propaganda at narasi bisa dilakukan jelas jelas dilakukan oleh sumber negara tapi bisa jadi tidak dilakukan negara tapi kelompok yang punya  kepentingan  negara at mungkin pendapat Ahli dari suatu negara yang tak mewakili negara namun pendapat membangun narasi yang jelek bagi negara lain.Apakah ini dibendung dg hukuman at perlawanan dg data saja.,0,Ugww5obIf3maOytGaht4AaABAg,69
2026-01-30 07:00:00,@muhabyqosim5164,"FB sudah melakukan itu dg adanya notice ""bahwa komentar anda tidak terlihat di negara tertentu""",0,UgxFXShRTb0A9Kevsuh4AaABAg,15
2026-01-30 07:00:00,@muhabyqosim5164,Warning HRS klo Indonesia jadi tibet jilid 2 sudah terbukti di morowali  dan maluku,0,UgxKVuy--OVzYLqcdyR4AaABAg,14
2026-01-30 07:00:00,@BregasAdji,"Pelaku kejahatan HAM dipercaya jadi presiden bro😂😂😂. Tuh danantara Dalio bukankah orang asing. Thaksin itu akhirnya dipenjara gitu jadi dewan nasihat 😂😂. Maunya Prabowo itu kita itu harus Manut kayak Boby kucingnya. Lapar tinggal ngeong lalu diberi 😂😂. Ingin dimanja ngeong. Jadi ingin diberi jabatan Prabowo ya harus mau jadi buzzer mereka 😂😂. Yang saya heran Ronal Tanur pembunuh dengan cara melindas pakai mobil malah dapat remisi, padahal sudah terbukti bersalah Hakimnya. Malah tersangka dapat remisi. Logika macam apa itu😂😂. Jadi pembebasan Ronal Tanur ternyata sudah diatur oleh Ibu Ronal Tanur dan pengacaranya dan terbukti Korupsi 😂. Eh Presiden memberikan REMISI karena berlaku sopan ketika berbicara dengan Presiden 😂😂. Edan 😂😂",0,UgwT6pDDc4Ei10lzdOt4AaABAg,111
2026-01-30 07:00:00,@ayusulistiyani1768,"Ajak ke psikiater aja, biar bisa diatasi dengan baik.",0,UgzgOGr61bGIQYJz4xh4AaABAg,9
2026-01-30 07:00:00,@ThonilWirawan,"Bahas benix dong,",0,Ugzdrql8xP46l_pLY_N4AaABAg,3
2026-01-30 07:00:00,@ronibetas3439,rambutnya baru model antek antek aseenggg,0,UgyaXeNdlDNFxIrnBfF4AaABAg,6
2026-01-29 07:00:00,@muhammadirfanhidayatullahp86,"Tempo dapat dana berapa tiap tahun dari George Soros ? Spill dong

Kok bisa sampe mau buat propaganda, ngehancurin negara sendiri, berapa sih bayarannya, penasaran asli",0,Ugz5UH00RXaNg0TU_jB4AaABAg,26
2026-01-29 07:00:00,@muhammadirfanhidayatullahp86,"Menurut keyakinan saya, kalian ini Media provokator..
Agen intelijen berkedok kebebasan pers, pemerintah sedang berusaha membangun negara, selalu aja media ini cari cari bahan utk provokasi masyarakat.. ga akan pernah percaya lagi sama media2 seperti tempo ini..

Media2 seperti inilah yg membuat propaganda yg mengakibatkan kerusuhan di berbagai negara, membuat negara tidak stabil..",0,Ugzye1vOPmdGRTnDEbB4AaABAg,53
2026-01-29 07:00:00,@jitopasaman1490,Owalah TEMPE BACEM.,1,Ugw6_2VEp-WSP3M-9MJ4AaABAg,3
2026-01-29 07:00:00,@jitopasaman1490,Kalau ada Media antek asing juga harus di sikat dari bumi pertiwi. 😂😂😂. Karna diam2 ada beberapa media peliharaan nya soros,0,UgyW2ls9T0xQbKA8RL54AaABAg,21
2026-01-29 07:00:00,@AltioraQuaeriteCH,"Dia pake cara Trump, cara fasis berkuasa. Dia sendiri penjilat AS.",0,UgyUf-vbn0rDNshuFy14AaABAg,11
2026-01-29 07:00:00,@aminreaves,Antek dajjal teriak antek asing,0,UgzYEYGM2UbuizO0lJ94AaABAg,5
2026-01-29 07:00:00,@minganmingan6084,prabowo hanya omon 2 faktanya nol besar tida terbukti,0,UgyQScAnMfW83ZAHssR4AaABAg,9
2026-01-29 07:00:00,@kertaskarbon-14,antek asing itu yg setor uang trilyunan ke dewan2an perdamaian Trump bukan🤣,0,Ugz3vqV_Zb1LhWRiE_t4AaABAg,12
2026-01-29 07:00:00,@arthurhutauruk5355,Antek asing itu ada tergantung perspektif anda menilai yang mana .sekarang maling berteriak maling,0,UgyyoW3T41XQtpTVdwh4AaABAg,14
2026-01-29 07:00:00,@666-pluto,"Sebut wo, antek asing itu siapa? Negara mana aja? Ahahaha... jadi pemimpin kok anti kritik. Besok pilih gen z aja udah. Boomers suruh pensiun 😂",0,UgxKyI69SC7bDj5SkBV4AaABAg,25
2026-01-29 07:00:00,@Anto1983-vb8oh,sedang mencoba membungkam,0,UgzaEyoSBWMt1RZKjkJ4AaABAg,3
2026-01-29 07:00:00,@agusriyanto891,Mbah wowo sendiri yg antek asing...buktinya malah tunduk kepada kakek trump,0,Ugy7ATtAHX58BIooGvV4AaABAg,11
2026-01-29 07:00:00,@heruwidyana8380,Jangan sampai kejadian di Minneapolis terjadi di Indonesia tercinta ....,0,UgxjZkcYljUNnwRlB-p4AaABAg,10
2026-01-29 07:00:00,@nendipermana5000,"Dia yang paling teriak anti antek asing, tapi sekarang dia yang jadi antek nya donald bebek dan setannyaho. bahkan rela bayar mahal buat gabung kelompok mereka, hampir 17 T.
Namanya juga presiden omon-omon, semuanya tersedarh dia, mumpung berkuasa, dan bahkan persiapan melanggengkan kekuasaanya.",0,UgwUwaeeUmV-vRrkUGZ4AaABAg,43
2026-01-29 07:00:00,@irwansyamsuddin8988,"kalau ada antek antek asing siapa,tangkap,pataaaaahkan ,umumkan..., omon omon trusss....kerjA lebih baik dari pada orasi orasi yg membosankan buru itu pencapaian 8% pertumbuhan ekonomi indonesia!!!!",0,UgxEUH-bvSu2EHNgbaJ4AaABAg,25
2026-01-29 07:00:00,@peacemaker2510,Sebarkan berita yg positif untuk energi positif Indonesia,0,Ugxzimxpcvjc0tcPONh4AaABAg,8
2026-01-29 07:00:00,@yogapratomo9787,justru orang-orang di sekeliling Prabowo- yg bisa menghancurkan ekonomi rakyat 😁😁😅,0,Ugx9f9FVQrKTEOAH_794AaABAg,11
2026-01-29 07:00:00,@cillabaeung3854,"Koar koar antek asing, eh tapi bayar miliaran buat gabung PBB buatan Donald Trump. Dari dulu ketujuh presiden Indonesia ga mau yang mau buka hubungan diplomatik dengan ISRAEL, sekarang tiba tiba kenapa presiden peduli keamanan Israel. Yang menjajah dan buat onar itu ISRAEL.
INI JUDULNYA ANTEK NETANYAHU ALIAS PEMUJA ISRAEL",0,UgzJBC5iTLR8DcQpK4l4AaABAg,50
2026-01-29 07:00:00,@LisannyaGaib,"Bukan milyar lagi, trilyun. 17T ilang buat bayar upeti",1,UgzJBC5iTLR8DcQpK4l4AaABAg.ASVc6lykGSgASVmH8eflAE,9
2026-01-29 07:00:00,@Naufalghifari24,Rezim yang bilang antek asing biasanya adalah rezim yang selama dia berkuasa berbuat otoriter dan korup. Narasi seperti itu adalah ilusi palsu untuk menarik simpati rakyat demi legitimasi kekuasaan yang padahal rakyat tidak m memahami substansi kebijakan apa yang dibawa oleh pemerintah,1,Ugz0-IJa8RRX1440VMd4AaABAg,42
2026-01-29 07:00:00,@triasandayani3713,Kita harus percaya adanya antek asing.siapa yg membuat kisruh negara2 di dunia ini?KLO bukan negara yg tidak ingin Indonesia maju. KLO temp bukan antek asing ya g usah bingung,0,UgwRcYXZVRGldKLlky94AaABAg,29
2026-01-29 07:00:00,@margonopurwodadi1363,Paranoid takut akan cermin sendiri,0,Ugz6Cd51oRwFkJEuvCl4AaABAg,5
2026-01-29 07:00:00,@belacan_gorng,"Wah 
Itu terjadi sih udh gak asing lah, ulang karna pemikiran rakyat sendri sih
Liat Iran  di demo besar2an kena masyarat, malah di bunuh sampe 2000an ningal, dalih pemerintah apa antek asing padahal menyelamat hegemoni nya, dan rakyat kita gak ada tu yg protes pemerintah Iran yg udh membatai rakyat nya sendri malah menyetujui narasi pemerintah Iran, dan Prabowo berkaca di situ kalau ada demo besar2an, enak dia mengangkat orng demo tu degan tuduhan antek asing",0,UgwbXObkry_jY6HApTZ4AaABAg,76
2026-01-28 07:00:00,@evan5808,"Bodo amat mo negara ini mo perang mo hancur jg alhamdulilah. Krn ngapain jg rakyat hrs susah2 jagain negara ini dr penjajah asing, toh mereka pemerintah kt jg penjajah di negara sndiri. Sejarah Negara ini bs merdeka krn rakyatnya terjun kemedan perang, krn itulah negara asing takut, segan utk kembali menjajah negara kt. Tapi krn sifat serakah pemerintah, dan mereka merasa negara ini sdh aman. Jd mereka meninggalkan&melupakan rakyat terutama(rakyat miskin). Jd smg aja bnr2 terjadi perang dunia. Krn sy yakin rakyat sangat senang krn rakyat jg udh capek, lelah hidup dinegara miskin yg pemerintahnya hanya memkirkan diri sndiri&kpentingan kel mereka aja. Jd klo perang nanti, ya sruh preaiden, DPR, TNI, POLRI dan pejabat2 pemerintah aja lah yg turun ke medan perang, saya jamin rakyat gak akan sanggup dan mau turun ke mwdan perang krn mereka lapar dan terlalu miskin utk turun membantu ke medan perang. Monggo silahkan klian yg merasa keluarga pejabat, menteri dan dinas2 terkait saatnya klian membalas jasa negara yg sdh memberikan kebutuhan2 klian selama ini. 😂😂",2,UgyMhYGWRRc83y-ptJh4AaABAg,170
2026-01-28 07:00:00,@adisusilo9327,"Judulnya ""antek asing triak antek asing""",0,UgwF5RMZ-qpI8Qb3VLF4AaABAg,6
2026-01-28 07:00:00,@TiopanPanggabean,"Tim Tempo bahas Kamboja lagi dong, ini ada sekitar 2400 lebih warga kita di KBRI Phonm Phen yg menunggu nasib.. Dan ada wacana judol dan scam akan pindah ke Sri Lanka atau Timor-Leste",0,UgzNdMrHnDVaSMhkpRV4AaABAg,33
2026-01-28 07:00:00,@KhairilAnwar-u2k1t,Hahahaha Indonesia korupsi maju sampai kiamat,0,Ugw9IUxf_Wv5Rz8bfKZ4AaABAg,6
2026-01-28 07:00:00,@kuncungbawuk5969,Lengserkan segera biar ga tambah parah,0,UgyDr773-rYHgBY3Xl54AaABAg,6
2026-01-28 07:00:00,@AzizahAzizah-v4d,"Sy sarankan ya...lebih baik tiarap az..bilangi bos kaliyan..
Bisa jadi Tidak lama lagi akan ada informasi aliran uang asing ke tempo...dan rakyat dibuat marah ke tempo..lalu di segel rakyat lah..
Trus kaliyan bisa apa???😂😂😂",2,UgyVrFLQuoQTVQE9MFl4AaABAg,34
2026-01-28 07:00:00,@AzizahAzizah-v4d,Tempo kepanasan..merasa kali 😂😂😂,2,Ugwzkk3SLyW9qoIuPtF4AaABAg,4
2026-01-28 07:00:00,@satubarkah3904,Musuh brsm ya jokowi dan gerombolannya. Yg publik blm phm apakah prabowo bagian dr termul bkn....!!??,0,UgzKsqdNYd-WoG_WfTB4AaABAg,16
2026-01-28 07:00:00,@sinsyafiuddin3379,Nanti akan ada masanya rakyat indonesia bilang salah satu presiden terbaik indonesia adalah prabowo! Dan 3 orang itu tidak lebih baik dari prabowo,0,UgzBwVgGyVlc7ksjCFF4AaABAg,23
2026-01-28 07:00:00,@ariwidianto6504,Antek setan 😂,0,Ugwo0Wg4k8AzLm2RzHp4AaABAg,3
2026-01-28 07:00:00,@LixBorea,"1 Agustus one piece trend
4 Agustus USSOCOM Amerika kasih penghargaan ke Prabowo
25 Agustus Pagi trend buzz positivity puan
25 Agustus siang agenda anomali

👀",0,Ugzt-HoE6PGL7sU5soN4AaABAg,26
2026-01-28 07:00:00,@alvenskirafiola3234,aki2 hahah pake cara jadul padahal satu negara udah tau dia penjahatnya,0,Ugy9necazRAfceusD-d4AaABAg,12
2026-01-28 07:00:00,@nugioism2273,Memang antek asing,0,UgzVfTj1uELElIVGPf54AaABAg,3
2026-01-28 07:00:00,@AzizahAzizah-v4d,"Ngoceh tdk ada bukti...faktax yg hrs disampaikan...jgn ngomong katax...ckck
Bagusx cek gaji 3 orang ini..
Karyawan tetap atau outsourching...",1,Ugx1Ad9NdKCWhrnSyR54AaABAg,19
2026-01-28 07:00:00,@steven658,"orang orang *** yang bikin peraturan tapi tidak pernah dijalankan, sungguh pekerjaan yang mubazir",0,UgxmD58I8J8k2a0gRC54AaABAg,14
2026-01-28 07:00:00,@adipradana3068,That oldman,0,UgxiHmxkLcjtXwPvGYx4AaABAg,2
2026-01-28 07:00:00,@kangsandipetot,"Sekarang malah gabung Board of Peace, jadi antek asing di Palestina 😏",1,UgzGiRTMHBaI8GFK_-14AaABAg,12
2026-01-28 07:00:00,@Saya-q3v,Heyy antek asing yg berkomplot dengan trump..,2,UgzsyUej0Dm5sFx7XEV4AaABAg,7
2026-01-28 07:00:00,@pingpong-s1f,"antek asingnya ya si gemoy siapa lagi,,,😅....",1,UgwcPbwyDtRS4zHRNcZ4AaABAg,7
2026-01-28 07:00:00,@gaktau-uuu,"""ant tech ant tech"" ahh sing",0,Ugz5Srxu8BLO8xQYXeV4AaABAg,6
2026-01-28 07:00:00,@OmSendi88,Segera Brantas dan Ringkus semua Antek Asing..ya jelas ...para Media yg sering bikin Gaduh lmpormasi yg tak berdasar dan sering profokasi memicuh perpecahan dan penerima Dana Asing dg kepentingan Terselubung kepentingan gelap yg dilakukan CIA AS Soros dan Anteknya yg jelas Strategi dan Proyek SOROS,1,UgzgH7sNPtr4EB7IU-J4AaABAg,45
2026-01-28 07:00:00,@beelzebub3210,egy mana ini?,0,UgxAgxnY73QjGT4K7K14AaABAg,3
2026-01-28 07:00:00,@zakky6409,"lah dia sendiri ngejilat Donald Trump 🤣
Minta Dikenalin ke anaknya Trump.. trus sekarang malah gabung Organisasi Bentukan Trump... gak gratis loh itu, ada iurannya sampe triliunan rupiah",1,UgzTawGYJUjRYBXVYfF4AaABAg,28
2026-01-28 07:00:00,@h1chae-mx,"""jadi pot... bunga""
""jadi pulpen teddy""

ya ampunnn sehat-sehat kak chicha😭😭😭",0,Ugx5PygIXHRXNpu-2Pt4AaABAg,11
2026-01-28 07:00:00,@nadilalaode4915,Prabowo antek asing !,0,Ugzci70gELWlgA5SKqN4AaABAg,4
2026-01-28 07:00:00,@bapakethole999,Semut di negara asing kelihatan. Antek asing di pelupuk mata tidak kelihatan.,0,UgwVZomurUQDrgkAFmB4AaABAg,12
2026-01-28 07:00:00,@Jaimehuhu,"studio baru nich..lebih enak dilihat, closed-up makin mudah dicerna, no unnecessary distraction, mantap",1,UgwI3EdHJUPE0nZDhdJ4AaABAg,13
2026-01-28 07:00:00,@bambangharymurti6980,"Bagaimana kalau yang mengeluarkan ""disinformasi"" itu pejabat pemerintah sipil atau militer?",2,UgxXZHHqpZJ6W0F91vJ4AaABAg,11
2026-01-28 07:00:00,@ardikurniawan5987,"jaman jokowi musuh bersama adalah radikal radikul
jaman prabowo musuhnya antek antek asing
wkwkwk",0,UgwEQQiqp5SkIdJoDgV4AaABAg,14
2026-01-28 07:00:00,@yamiRic,"Tetap semangat, Tempo",0,UgyssQfkCy6BYrobUUt4AaABAg,3
2026-01-28 07:00:00,@jdtmanggarai,"Angkat topi sama Tempo, kok bisa yah dapat info A1 dari istana.",0,UgwuAa6ceWHzAB0S_NZ4AaABAg,12
2026-01-28 07:00:00,@TheHigherSky,Si omon omon lah antek asing,0,UgxcwRa0TG9L2_25hjp4AaABAg,6
2026-01-28 07:00:00,@gilangputraperkasa4470,"malah join antek"" aseng 🤣",0,Ugxz62s8a0FCVeH27d94AaABAg,5
2026-01-28 07:00:00,@tolekeling8324,Turunkan rezim omon omon & fufufafa 🙂,0,UgyI1cuUEcAflDmoTS54AaABAg,7
2026-01-28 07:00:00,@tolekeling8324,Si omon omon 😂😅😂,0,Ugw3zPp79mW5OLosiDR4AaABAg,4
2026-01-28 07:00:00,@hmmmm6157,Yang jadi anteknya trump kok gak dibilang antek asing ya. Emang trump orang indonesia ya?,2,Ugx7Gcvr-D0H0dqP13Z4AaABAg,15
2026-01-28 07:00:00,@kosnantonanto4646,"Kita lihat bareng2...
Arahnya dah bener pak prabowo..
Kadang media2 jg dibayar asing aseng...
Ayo ngaku",1,UgzJBrottOrV-Y0J76h4AaABAg,16
2026-01-28 07:00:00,@CandraSanghyang,"Rakyat digiring2 supaya benci pada asing,aseng asong.(bisikan syaethon disekelilingnya. Dengan tujuan supaya rakyat berbalik mendukungnya untuk 2029. Padahal dibalik itu dia dan seisi istana berbondong2 antek asing, diam2 menjual semua kekayaan alam ke asing dan uangnya bukan untuk rakyat tapi dimasukkan ke gentong dananrara untuk membuayai sahwat politiknya dan main saham di luar negeri .keuntungan masuk kantong pribadi.  Uang negara dikuasai mutlak sama dinasti gerinda nanti diambil seCuil untuk bansos jelang dekat pemilu.modus yang terang2an diajarkan oleh suhunya mentornya.",1,UgyI05thlEAvs1jWVNZ4AaABAg,79
2026-01-28 07:00:00,@alvajanuar1161,antara sepakat atau blank ? hihi,0,UgwXZaDCecjZppYSy2B4AaABAg,6
2026-01-28 07:00:00,@bagusasmorojati9688,Malu om sama Imam samudera,0,UgznkZgZAbmWFeZnqS54AaABAg,5
2026-01-28 07:00:00,@rendilovema,"Nationalist delegitimization strategy: strategi untuk mendeligitimasi kritik domestik dengan cara mengaitkannya pada musuh eksternal.

Fungsinya:
Mengalihkan isu dari substansi kritik (korupsi, konflik kepentingan, kebijakan)
Membingkai kritik sebagai ancaman kedaulatan, bukan sebagai kontrol demokratis
Menciptakan dikotomi “kita vs mereka”

Di sisi lain
NGO kecil, aktivis, dan media independen mudah diserang karena:
Tidak punya kekuatan koersif
Tidak punya legitimasi elektoral
Tidak bisa membalas dengan instrumen negara

Sementara kekuatan besar (asing atau domestik) tidak disebut “antek” karena:
Dibutuhkan untuk stabilitas kekuasaan
Dibutuhkan untuk investasi, pengakuan geopolitik, dan dukungan elite

Jadi label “antek asing” di sini menjadi alat politik untuk membungkam kritik.

Nasionalisme → alat retorika
Oligarki → mitra struktural
Kekuatan Asing → dirangkul, yg masalah jika mengganggu kekuasaan
Kritik → dibingkai sebagai ancaman negara

Inilah logika rezim kekuasaan yang membutuhkan musuh simbolik bersama untuk bertahan.",1,UgyGzuDyNrMKJHSTlWB4AaABAg,132
2026-01-28 07:00:00,@socrates1796,ini efeknya kalo orang kebanyakan nyawit,1,UgydK7RxiqAszkg_eAZ4AaABAg,6
2026-01-28 07:00:00,@ERIKNBA,"Istilah yg lazim yg sering dikatakan di era-era kekuasaan soekarno itu adalah ""Anthek Imperialis""dalam setiap tajuk pidato-pidatonya,
sehingga istilah ini sesuai dengan perkembangannya menjadi istilah ""Anthek asing"" di mata Pak Prabowo melihat sisi kewaspadaan dan kekawatiran selama ini atas cengkeraman para penguasa diluar pagar ini beliau mengganti dengan istilah ""Anthek asing""  apalagi presiden kita ini gaya pidatonya yg selalu blak-blakan ceplas ceplos tanpa tedeng aling-aling hal ini akan sangat nampak antagonis bagi para pembencinya termasuk media"" ciptaan kaum olygarki"" yg punya tendensi mengganggu jalannya demokrasi.",1,Ugyb7VBW6S_r0rPfUct4AaABAg,85
2026-01-28 07:00:00,@AgusSuprayitno-c5i,Neg tenang damai tempo TDK rela,0,Ugw-3P0xdlI5QKqDIAZ4AaABAg,6
2026-01-28 07:00:00,@AgusSuprayitno-c5i,Antek asing ya tempo maunya mengadu domba antar anak bangsa dgn pemerintah anak bangsa dgn anak bangsa,2,UgwLEnNKVPALpMB9shV4AaABAg,17
2026-01-28 07:00:00,@julwardsiburian5227,"Kalau kamu bisa memimpin dengan baik,maka seperti apapun propaganda dari negara lain tidak akan bisa mempengaruhi masyarakat",2,UgwU5HcbFcGG_3nSxCF4AaABAg,17
2026-01-28 07:00:00,@AbuAbdullah-jm4to,😮 ternyata dia sendiri yg antek asing 😅😅😢😢😢😂,0,UgyrB-c70LWkEkwDW054AaABAg,8
2026-01-28 07:00:00,@anniepuspitasariwahyuningt5924,Menciptakan musuh bersama udah kaya Wicked ajaa 🤧,0,UgwS8L4eQGKZ--7OD894AaABAg,8
2026-01-28 07:00:00,@KampungLorong-s4r,"Antek Korupsi dan ANTEK  Penghianat Negara adalah Musuh Orang Orang yang Ber AKAL WARAS,",0,Ugz_a--EILPBeg4DYf94AaABAg,14
2026-01-28 07:00:00,@madz6278,Padahal dia yg gabung buatan antek asing israe sama trump,0,Ugx4eq1Ye4QLFdK161t4AaABAg,10
2026-01-28 07:00:00,@yasuda_tiadarisau,"""asing"" itu identik dgn bangsa barat.
""aseng* itu identik dgn bangsa cina.
Sejarah mencatat jargon nasionalis itu cuma gencar di kokopkan dijejalkan dicekokan ke rakyat.. sedang penguasa ngga ad masalah jual² tanah & air ke asing/aseng.. cari tunjangan pensiun buat family via share hak kelola SDA..",1,UgwjiVs8IbosEY-j0uJ4AaABAg,46
2026-01-28 07:00:00,@DHNY890,"Mungkin yg dimaksud asing adalah ""asing"" buat agendanya dia dan pemerintahannya. Bukan negara luar tapi orang2 yg berfikir kritis dan cerdas yang membela kepentingan asing (baca: rakyat kecil).",1,Ugza9HM7gQB4-JAbkxJ4AaABAg,28
