tanggal_baca,clean_author,clean_text,like_count,id,word_count
2026-01-25 07:00:00,@nasionaliskiri706a,"Ngomong antel asing mulu, padahal mungkin antek asingnya ada di pemerintahan dan lembaga negara. Kalo cuma ngomong antek asing doang tapi tak melakukan apa apa ya cuma omon omon doang.",0,Ugxhx4E-llGML0B0MT14AaABAg,30
2026-01-25 07:00:00,@mangkokbeling922,36:18 PKI sebagai propaganda musuh bersama ga dimention nih😂,0,UgwkN8Gt1e3apF6VVTR4AaABAg,9
2026-01-25 07:00:00,@gandiohio9044,"Di Setiap negara, pasti ada Pemain penting yang mengendalikan ...hanya orang yang tolol coba mengaliihkan opini ...kritis boleh tapi gunakan logika,,,antek asing , seperti china, Amerika ,inggris,  para oligarki kelas kakap pasti berperan penting dalam politik,",2,UgzHm_95pTNhaNqGmgh4AaABAg,36
2026-01-25 07:00:00,@dessyriana,Ada penampakan Jin di belakang Hussein. Hiyyyyaaa...😂,0,UgwMuY9j4Dx1dO6aQ2h4AaABAg,7
2026-01-25 07:00:00,@daarulumam,Pen kentut gua denger si omon2 ngedumel,0,Ugy6nNHq9MYshlhXHK94AaABAg,7
2026-01-25 07:00:00,@radfix02,Orang yg suka teriak antek asing....padahal dia sendiri yg penjilat asing.,0,Ugzu4r5dWt4i6nDdcKR4AaABAg,11
2026-01-25 07:00:00,@bungratno641,"Propaganda asing  yg sy pahami adalah menyebarkan hal2 terkait kepentingan asing,ideologi asing.Apskah agama yg berasal dari luar negeri termasuk kedalam penyebaran propaganda asing?",0,UgxAge2JScoKH9DRBrJ4AaABAg,23
2026-01-25 07:00:00,@variovario9124,Bagus,0,UgzKzxS5twncjCE8hNd4AaABAg,1
2026-01-25 07:00:00,@hazamyuncle6784,"Bukannya introspeksi, malah teriak antek asing. Wowo Dodol.",0,UgwZMs6DaVk7VinAkzV4AaABAg,8
2026-01-25 07:00:00,@erickgorga6259,Buruk muka cermin di belah itulah wowo,0,UgxYM0vcNo0QWXJptWJ4AaABAg,7
2026-01-25 07:00:00,@aremania,"selama ini aku juga berpikiran hal yang sama, selalu yg disalahkan asing padahal salah mereka sendiri",0,Ugx7_iGdQ59delPYbmB4AaABAg,16
2026-01-25 07:00:00,@jujoe9092,Sebelum 45.. .belum Indonesia....,0,UgzYw5811_C0QcwKWUB4AaABAg,4
2026-01-25 07:00:00,@ekosuprato3864,Animal farm animal farmmm,0,UgwPUIwwWuL6LfuX1Uh4AaABAg,4
2026-01-25 07:00:00,@Rorschach9876-p4e,Akhirnya 'labelisasi' ini dibahas oleh Tempo,2,Ugxmw75pacTiJIPW6ex4AaABAg,6
2026-01-25 07:00:00,@borsaksirumonggur448,"Semakin REPRESIF.,Makin SAVAGE para TENRYUBITO ini..",0,UgzbmGbthZ-8SjMGpXN4AaABAg,6
2026-01-25 07:00:00,@inetreynaldy-pr1is,Teriak² antek asing tapi bolak balik ngemis ke asing. Intinya Prabowo ingin orba jilid 2,0,UgxvJPDavN30iqoRhAt4AaABAg,15
2026-01-25 07:00:00,@indrawiraguna,"Susal ngomong sama orang hidup menara gading, udah dimenara gading dalam gelembung juga",0,UgywrEUUHkTrpV_5M4p4AaABAg,13
2026-01-25 07:00:00,@sutamaarimbawa674,ah antek2 aseng :face-blue-smiling: btw antek2 asing itu barat atau timur?,0,UgwlkkOeWkUXOltSBEh4AaABAg,11
2026-01-25 07:00:00,@urikahouse,Lebih baik antek asing daripada koruptor2 pribumi,0,Ugz8Eof-1jcwk5ruwG94AaABAg,7
2026-01-25 07:00:00,@Daniel-ph6fq,"Siapa disini yg jd bagian 58%, angkat tangan.. JANGAN MALU COY 😂",1,UgxEsEXs6R5kqkpx7Mx4AaABAg,12
2026-01-25 07:00:00,@bd-gz6bw,Dan wowo adalah antek jokodok 😂,0,UgwJT3x_XPFpXXIKdpF4AaABAg,6
2026-01-25 07:00:00,@habibpamungkas3503,Bahas donk anomali antara evisiensi dan kenyataan nya.,0,UgzaSQifmhhiN71arhR4AaABAg,8
2026-01-25 07:00:00,@Gajahmada4-f5g,Sampai kapan memerangi antek asing??!! Rakyat keburu nyungsep,0,Ugzac484kA7rwdvWhJF4AaABAg,8
2026-01-25 07:00:00,@ibrahimbaimpetrozza4658,"😮Gini klo negara di
pimpin oleh org yg sdh lansia,semangatnya tinggi berkobar kobar tp prakteknya nol so taiii kucing woo😅😅😅😅😅",0,UgxB57nHLoGfLNBBuf14AaABAg,20
2026-01-25 07:00:00,@Antokbre,TEMPO MENCERDASKAN DGN ANALISA YG NETRAL DAN TERBUKA,0,UgxATq2Pq4OYrL2pioN4AaABAg,8
2026-01-25 07:00:00,@kuanganhauw5695,Gara gara nonton film Herman Goering kayaknya.,0,UgwNPhgCtAnN_4HeiR14AaABAg,7
2026-01-25 07:00:00,@kamekame2818,"Owo demen omon'
""Hai antek² asing...""
Pdhl slm ini yg mnjd antek asing maupun aseng adl penguasa sndiri mngatas namakan demi rakyat
Demen ngutang, ngemis bantuan, investasi & kerjasama ke asing 
Impor ugal²an shg bnyak usaha yg bangkrut krn dibanjiri barang import yg murah
Tega mnyengsarakan rakyatnya dg membuat regulasi & kbijakan yg mnguntungkan asing sbaliknya merugikan & mnyengsarakan rakyat & negara
Demen jalan² ke luar negeri
Pernah kabur ke luar negeri

Halah... Itu cm akal²an rezim skrg kembali mau otoriter shg anti & alergi kritik dg membungkam para aktivis & suara² kritis yg dituduh sbg antek² asing
Paradox + kontradiksi",0,Ugy38tlotOM96LO03O54AaABAg,101
2026-01-25 07:00:00,@AntiPembodohan,7:38 metode prbw ni.. dulu putri Moh. HATTA jg dcatut jd pendri g3r1ndr4...,3,UgxzoZah4R58bvwGpLl4AaABAg,13
2026-01-25 07:00:00,@geminiabadi5521,"Simple aja...Bagi Mr. Paradoks,,,siapa pun yg ber seberangan dengan dia,,,adalah antek asing,,,bagi yg bisa ngasih utang di anggap bestie:face-purple-crying:",0,Ugxad0tvGrezOepIguh4AaABAg,19
2026-01-25 07:00:00,@apakansaja8505,Betul Indonesia itu undervalue... maka nya mahu di turunkan lebeh rendah lagi nilai Rupeeah jadi 20.000 per 1 USD...Biar Antek2 Asing bisa masuk menguasai aset2 negara dgn murah... Udah Mantap lah ni... 😊😊😊,0,UgyTgIo-4DSzPR0KunB4AaABAg,33
2026-01-25 07:00:00,@AntiPembodohan,Rezim propaganda bikin UU propaganda,1,UgyvNP3euWDt4JdB7Gx4AaABAg,5
2026-01-25 07:00:00,@creakidspakuan9637,"antek asing ... antek asing, ditujukan buat rakyat yg kritik atau pada orang-orang sekeliling dia sendiri pak presiden ini ?

Yg jelas rakyat sendiri yg diasingkan, dianggap tinggal ngontrak di negeri sendiri oleh kalian yg menjabat.",0,UgzwbNRtrFCvjDk_fQF4AaABAg,36
2026-01-25 07:00:00,@ulasalba3369,Lantas nanti Pandji dilabeli antek asing 😂😂😂,0,UgztQeNU8n8taLnm_uB4AaABAg,7
2026-01-25 07:00:00,@Ndank_63,"Aku melihat yg paling berbahaya itu adalah para pejabat pemerintah (eksekutif) yang korup, termasuk pejabat legislatif dan pejabat yudikatifnya.
Faktanya memang begitu. Fakta itu tak terbantahkan. Terkatung-katungnya pembahasan UU Perampasan Aset adalah salah satu indikatornya.
Antek asing tidak akan mampu berbuat apa-apa jika pimpinan dan para pejabatnya tidak berjiwa korup.",0,UgzMGkCyYSAt6vx_kl94AaABAg,50
2026-01-25 07:00:00,@taufikfatahillah2077,Itu dengan Trump ngapain?,0,UgxOyLIHiY4A1wKq1L54AaABAg,4
2026-01-25 07:00:00,@BarraBara-d9g,Gak menarik hanya manrik kalau menyangkut berita Jokowi doang 🤧,0,UgzRijGi_PNh4geK5SN4AaABAg,10
2026-01-25 07:00:00,@Nuclear241,"Close enough, welcome back Kementerian Penerangan",0,Ugwt96aoAERGRuxjNbl4AaABAg,6
2026-01-25 07:00:00,@SAHam99,Agar aman dari antek asing sebaiknya tinggal di surga saja. 😂,0,UgxBUj6u_T_TppDvpmp4AaABAg,11
2026-01-25 07:00:00,@diditariofficial2737,Saatnya nonton potkas bocor alus,0,Ugw7aBgmHrE08Dahdop4AaABAg,5
2026-01-25 07:00:00,@deedeeimut,"Dia yg sohiban sm si trump, malah telponan sm anaknya segala... Lah dia juga yg tereak antek asing. 🐽🐽🐽",0,UgwMUBwSQoXg35Jkp254AaABAg,19
2026-01-25 07:00:00,@Hensei5339,Kopkamtib coming soon. Kritik apapun akan dianggap menentang negara 🙃,0,UgzAcA6LDlXuTwoklTB4AaABAg,10
2026-01-25 07:00:00,@theman9203,Apa cuma gw yang merasa kalau sibapak tersebut secara 'kreatif' agak2 ngikutin beberapa teknik2 nya  pak de trump?,0,UgzQ5FwHViaYv198KdZ4AaABAg,18
2026-01-25 07:00:00,@AdamSutanto,ciee ganti layout ruangan baruu aku bru liat maapkeun penonton baruu,0,Ugw7DV--OLRl7f2oP7B4AaABAg,11
2026-01-25 07:00:00,@thiaarnott88,"Setuju dgn analysis dan pendapat tempo team rikang, Hussein chicha.. anda brilliant👍👆🙏✌️ peace from Australia",1,UgzgtealxihzXqePVq14AaABAg,15
2026-01-25 07:00:00,@theorangecat2929,"""Antek Asing"" is the new ""Kadrun""",0,UgwMIHE6mcBOUcsXfk14AaABAg,6
2026-01-25 07:00:00,@diahayu9932,Pesimis . Lima thn cuma habis tnga buat urusan yg buat rakyat tambah sengsara. Omon2,0,UgwDYPGJ-x-i3ETTmPN4AaABAg,15
2026-01-25 07:00:00,@rubishlove2082,"Antek asing memang musuh bersama karena merupakan musuh dalam selimut, perlu program counter Intelijen yang mumpuni untuk menangkap mereka... Tanpa itu semua akan sia sia saja",0,UgyC53WqhS5dOYl-aCF4AaABAg,26
2026-01-25 07:00:00,@Okazthedestroyer,"(Maaf jika komentar ini sedikit diluar konteks video ini) Jujur, narasi antek-antek asing ini mirip-mirip seperti yang narasi yang dibilang oleh Pemerintah Iran disaat demo-demo di awal-awal tahun ini, yang dimana mereka bilang kalau semua demo-demo tersebut dibiayai oleh antek-antek asing. Demo Iran disini itu sebenarnya murni karena keresahan masyarakat terhadap perekonomian yang semakin menurun, kalaupun misal kedepannya ada bukti kalau ada antek-antek asing yang memengaruhi demo di Iran, itupun juga tidak semua orang-orang yang melakukan demo tersebut dan hanya sebagian kecil yang terpengaruh oleh antek-antek asing",5,UgwFBg7cktL3RiwURod4AaABAg,87
2026-01-25 07:00:00,@feritrihandoko4296,"Benci bgt sama yg dikit2 bilang teroris yaman, dikritik dikit langsung bilang gt.",0,UgzsIq7bLedE45pZSDl4AaABAg,13
2026-01-25 07:00:00,@Antonbudiman-t1j,Pemerintah sangat parah.,0,Ugw8ZZFIq-fLeEVrJp54AaABAg,3
2026-01-25 07:00:00,@Antonbudiman-t1j,Bukan antek asing yg pasti antek dalam kabinet prabowo sendiri bilang antek asing cuma pengalihan isu aja,0,Ugxn6CMzQVrVC4lqqHB4AaABAg,17
2026-01-25 07:00:00,@DAGANGBAROKAH,"Bantuan = ANTEK ASENG
Hutang = INVESTOR ASENG",0,UgxXO99fO_y3SWedtQN4AaABAg,8
2026-01-25 07:00:00,@RagilKusuma-kb4jq,"Gw org pertama yg di labeli ""antek asing"" sama rezim gemoyyy jg ngga masalah, ""antek asing"" itu org yg kritis dgn kegilaan rezim Mulyono dan Gemoy. Emak-emak yg kritik isi MBG anaknya jg antek asing?! Hidup antek asing!.",0,UgykLPLVM1DCkY_wXdZ4AaABAg,38
2026-01-25 07:00:00,@sibolga-taptengsalam6594,Tempo The Real Antek Asing dan didanai asing,1,Ugyqw9EnaCanfDSeLVl4AaABAg,8
2026-01-25 07:00:00,@sheklipit2995,"Gimana ya... 
Tempo sahamnya dimiliki soros trus bahas antek asing. 
😂",0,UgxMyiAN3I_9aXFa3wV4AaABAg,11
2026-01-25 07:00:00,@HenhenSugema-h6d,"Fransisca langsing sekarang,nambah cantiknya",0,UgyymuFexKssejWKznp4AaABAg,4
2026-01-25 07:00:00,@asgafhanafi1087,"anti antek asing,
tapi hutangnya ke asing,
sumber daya alam banyak di kuasai asing,
bahkan di morowali sampai ada istilah negara dalam negara,
karna disana ada ribuan pekerja asing & bandara asing,",3,UgzCqdmFuDTnr3JPFYt4AaABAg,32
2026-01-28 07:00:00,@KutuKhan6467,😱😱😱,0,UgzCqdmFuDTnr3JPFYt4AaABAg.ASMTwO7QsO3ASU3Hrzkdw3,1
2026-01-25 07:00:00,@Hari_onion,Antek Aseng ini narasi yg bahaya,0,UgxChXCfipsdzHs2xxF4AaABAg,6
2026-01-25 07:00:00,@areksuroboyo2128,"Klo dulu komunis jd propaganda, skrg antek asing. Jd ingat alm. chairman Mao, melalui revolusi budaya . Mirip2 spy melangengkan kekuasaan chairman Mao.",0,Ugws7EgeeDqaMws4Qn94AaABAg,23
2026-01-25 07:00:00,@satria6005,"Siapa yang akhir2 ini ngomong antek asing,, ya si Sjafrie... Tentara gagal...😂😂",0,Ugw66oL4vKtyETVRtuh4AaABAg,12
2026-01-25 07:00:00,@raffatar-b4x,"Antek asing antek asing, musuh negara ini koruptor dan pejabat ijazah palsu",0,UgxBqF1cqGaMmtRYpmt4AaABAg,12
2026-01-25 07:00:00,@satria6005,Rezim kosong dan otoriter... Menjijikkan..😂😂,0,UgyPmpaRBbr8UQsBKW14AaABAg,5
2026-01-25 07:00:00,@aaaaalllĺlllaaaammm,Ndak ada antek aSing YANG ADA ANTEK PRABOWO D JOKOWI...ingat rakyat indonesia tdak takut dg tentara asing..yg berbahaya musuh dlm selimut.,0,UgyFU4gmfV_NgVURFRN4AaABAg,21
2026-01-25 07:00:00,@Evogreebareno,"Rakyat ada yg di tuduh antek asing,,,???? padahal bos nya temennya??",0,UgzxieZb5Z_9BHVaX_94AaABAg,11
2026-01-25 07:00:00,@Kdwnto,"Biasanya PEMERINTAH YG KORUP, selalu NGELES “ANTEK ASING”",0,Ugxpythtac5mqz69Oa94AaABAg,8
2026-01-25 07:00:00,@multazamstore171,"Dari zaman ke zaman gitu aja mainannya penguasa. Rezim Orla melabeli lawan politik dg Nekolim, Rezim Orba main istilah subversif. Buzzer Rezim Jokowi  menggunakan label HTI, FPI, radikal. Sekarang Prabowo pakai istilah antek asing.",0,UgxpgLBFWE-s5Khni314AaABAg,34
2026-01-25 07:00:00,@dewisartika2189,Harusnya podkas ini judulnya upaya prabowo melenyapkan tempo 😂😂,0,UgzTInBQUwKSFeije_p4AaABAg,9
2026-01-25 07:00:00,@marwandijayaputra455,"Kekuatiran yang berlebihan atau lebay 
Menguruslah negara yang benar untuk rakyat..",0,UgxTCgrXKeHoRj4FyKN4AaABAg,11
2026-01-25 07:00:00,@ronaldyudoadityo8192,"Setau saya biasanya musuh bersama dibuat untuk mempersatukan kekuatan dan mengalihkan perhatian dari masalah sebenarnya. Nah kl omongannya ngak konsisten dengan kejadian dilapangan, menurut keyakinan saya alasan ke 2 yg lbh kuat.",0,UgyobpeG-2etxHn-NHV4AaABAg,32
2026-01-25 07:00:00,@dewisartika2189,Makin kesini Makin ambaradul aja ini Negara,0,UgxOfL5fQIkl_s4hBhl4AaABAg,7
2026-01-25 07:00:00,@osiae9642,Ternyata paradoksnya sudah muncul..???🤣🤣🤣,0,Ugyy0lQoSDzbbN5UHwN4AaABAg,4
2026-01-25 07:00:00,@lalarealistis,Cica mylopp cantik bangettt hari ini😘,0,UgxBBlWLhnIvfptheOp4AaABAg,6
2026-01-25 07:00:00,@dedensujana5881,"Heeey.... Tempo bukannya kalian juga adalah antek asing.kan kalian adalah anak buah George Soros,si yahudi itu",0,Ugy2TPv3TyLyjXVgJ_p4AaABAg,16
2026-01-25 07:00:00,@pr-mghanyar3867,Pemerintah Ibarat maling teriak maling,0,UgwMuQGlicdhQqxMowh4AaABAg,5
2026-01-25 07:00:00,@agungwahyu3871,"Venezuela hancur karena antek asing iran terjadi huru hara juga karena antek asing, bedanya iran menangani hal tersebut dengan tegas pemerintahannya bersatu dan militernya kuat",0,Ugz_-Jphb1C5my9kWLN4AaABAg,25
2026-01-25 07:00:00,@osiae9642,"Coba tanya Yusril….., pantaskah membuat draf uu. Macam begini…? Dia itu prof. HTN loh….., masak cuma segitunya saja?",0,Ugwvbl_bUhf2WqIMv014AaABAg,18
2026-01-25 07:00:00,@dedehook304,Inkonsisten Presiden Republik INDONESIA sudah MENDARAH DAGING dan KEBIASAAN tapi NAIF. inilah ciri 58℅ LARUT lalu HANYUT.,0,Ugw47lWaKJnU2H4CNl94AaABAg,17
2026-01-25 07:00:00,@infopakrt9060,Prabowo apakah sedang menunjukan bakti kepada mantan mertuanya? 😢,0,UgzBcSdrVqNXiP0VUFF4AaABAg,9
2026-01-25 07:00:00,@ironsugala3245,"Pertanyaan nya...
Yg lebih berpotensi tuk jadi antek2 asing itu....  dr kalangan kekuasaan/ pejabat atau kalangan rakyat biasa/masyarakat.",0,UgyFFJeCSOLxOPQ0Vul4AaABAg,18
2026-01-25 07:00:00,@osiae9642,Yusril…..🤣🤣🤣🤣🤣nggak kaget.,0,UgypPjUHC5zcxvQXSgx4AaABAg,2
2026-01-25 07:00:00,@radensyamill8734,"salah sendiri yang begitu kita jadikan Presiden, kan repot sekarang",3,UgzO_Piy3tYnYyJbLh94AaABAg,10
2026-01-25 07:00:00,@rebeccaramelan01,Disebutkan beliau mengaku belajar dari menteri propaganda Adolf Hitler,0,UgxigCBx2mGyTtnV3X94AaABAg,9
2026-01-25 07:00:00,@imawansugiharto9218,Begitu UU ini kalau nantinya disahkan pertama kali yg diproses hukum mungkin para jurnalis dr Tempo khususnya Bocor Alus😂😂,0,Ugw77SnSamfXMHjeoUB4AaABAg,19
2026-01-25 07:00:00,@erdiansahlan,Ancamannya bukan antek asing.. tapi program Prabowo itu sendiri 😂,0,UgznEED_RMCBFOHSodF4AaABAg,10
2026-01-25 07:00:00,@ireneana1199,Wapresnya juga kocak,0,UgxLRRtpP9pHiQtNDPt4AaABAg,3
2026-01-25 07:00:00,@handokohanny239,Antek asing = buat “hanya” warga sipil yg mengkritik ☝️,0,UgzBvReSmPSSNRgC8B14AaABAg,10
2026-01-25 07:00:00,@kickingman927,"itu karena kalian dpt sumbangan dana dari si soros itu, menurut seorg konten creator",0,UgyWmWyPftV7i2GVq3d4AaABAg,14
2026-01-25 07:00:00,@Akuvideo,"Kok mirip sekali dengan Hitler, Mussolini, Stalin, Mao Tse Tung dan semuanya diktator, semoga Tuhan melindungi Indonesia dari kebodohan dan keserakahan segelintir orang yg mengaku pemimpin 😢",0,UgxIRmxtzRm_ij6Lx5Z4AaABAg,27
2026-01-25 07:00:00,@OrangDesaKecil,Jangan jangan Omon Omon itu adalah antek asing yang sesungguhnya,0,UgzcpWKA5Mh7gAe42754AaABAg,10
2026-01-25 07:00:00,@sugitoikuk135,Jokowei luhutwei adalah antek asing nyat 😅,0,Ugzt3s4Le4-IT3S_Ajh4AaABAg,7
2026-01-25 07:00:00,@titos2057,"itu isu indonesia pecah pernah lewat di fb gue, disitu berisi dengan tidak efektifnya pemerintah menangani bencana aceh, dan upaya memaksa papua dan kalimantan menjadi kebun sawit, serta penerbitan kuuhp  di tahun ke 4 indonesia akan pecah

gak tau dah itu benar ato enggak, tapi jangan sampai terjadi 😢",0,UgydutLkLO0xV9NWE654AaABAg,49
2026-01-25 07:00:00,@sumantosumanto4506,Cm omon OMON yah saya sih kaga milih dia. gak berguna cm cari kambing kesalahan,0,UgwfbcKeq_kC5AfGMkd4AaABAg,15
2026-01-25 07:00:00,@rhzcb,Takut amat ama kritik,0,UgwdPZDc3z2RM85fXuN4AaABAg,4
2026-01-25 07:00:00,@waterheart123,"Ada kok youtuber yg jualan  kelas saham juga dikit2 bilang antek asing, apalagi ke media2 yg berani, macam tempo mungkin😂.",0,UgyV_A211gK1oGr1nsR4AaABAg,20
2026-01-25 07:00:00,@bambangwisudo4315,Siapa hayo ... bukan hanya antek asing tapi anteknya Trump ....? 😂,0,Ugzh-xSw-iX_9IZmAUd4AaABAg,12
2026-01-25 07:00:00,@edenfinch5299,Manisnya Negriku yg diperkosa sampe ke smpas ampasnya,0,Ugzl89QsToenEFi-2IF4AaABAg,8
2026-01-25 07:00:00,@sugengriyanto8131,Hebat presidenku ... mantan pangkostrad dan danjen kopasus. Strateginya luar biasa. Ayo tempo ... demi kebaikn bangsa terus kritis yg konstruktif. Tidak hanya modal niat baik saja tetapi harus lebih bijaksana. Selamat berjuang.,0,Ugz2zd1IyfeF5YKZbnZ4AaABAg,33
2026-01-25 07:00:00,@simplemarryman5305,Trima kasi tempo membongkar kelicikan kelompok tertentu,2,UgxUGM9Z5q2fd1EYetN4AaABAg,7
2026-01-25 07:00:00,@fernandoardyansyah,wih setup baru,0,UgwbYC2mxOpVGBsK8PV4AaABAg,3
2026-01-25 07:00:00,@Raharjagunawan,"Rezim omon omon adalah kelanjutan dari rezim otoriter orde Baru dan rezim gorong gorong munculah rezim Neo Orde Baru, selamat datang Indonesia, jutaan kaum intelektual Indonesia diam karena kita tidak punya jiwa patriotisme untuk meruntuhkan rezim penjajah ini karena semua orang menyelamatkan diri masing-masing dan Indonesia ini sesungguhnya sudah tidak ada karena elit politik pejabatnya oligarkinya adalah agen asing yang tidak peduli rakyat yang 68% rakyat Indonesia miskin lebih parah dari pemerintahan Hindia Belanda",0,UgyULzrYL6j-VKtBBfV4AaABAg,74
2026-01-25 07:00:00,@riandaarsal1024,asli presiden halu,0,UgxUblMeeGcPO-3dmGV4AaABAg,3
2026-01-25 07:00:00,@asmujiasmuji6672,Kasih cermin 🤫🤔,0,UgzCV36y_QEALdqnOzx4AaABAg,3
2026-01-25 07:00:00,@nozomi-pictures,Kasian rakyat Indonesia gua mah...,1,Ugyyt5lMlh5x387qBYt4AaABAg,5
2026-01-25 07:00:00,@fahrezalubis,simonokotil ini emang agak laen,0,Ugz0FgHzlByPYQBS-Rx4AaABAg,5
2026-01-25 07:00:00,@jhosbakar8573,klo kau wartawan kerjaan kau bertanya .bukan hanya duduk nunggu berita,0,Ugw5Q76nUw-zlcyqh814AaABAg,11
2026-01-25 07:00:00,@martinocarascalao9413,Wapres fufufafa bloon😂,0,UgyPa9dJGx54DzO3oG14AaABAg,3
2026-01-25 07:00:00,@valcriston,Lebih tepatnya antek2 petral dan mafia tambang.,0,UgzJJcvli0HMUa9kaAJ4AaABAg,7
2026-01-25 07:00:00,@valcriston,Normalize pake ringtone “ANTHEK ANTHEK ASYINGGG!!!”,0,UgyCNnm2X-AtmBuLX-94AaABAg,6
2026-01-25 07:00:00,@bernadetamurni9296,pak prabowo lama2 di julukin mr.antek asing....saking seringnya nyebut antek asing sampai saya bosen dengerin pidato prabowo,0,UgxBepbtwmyRTPcTDMZ4AaABAg,17
2026-01-25 07:00:00,@dindaayu3305,lagi  minum  kopi  keselek  AGEN   Elpiji😂,0,UgxbRMfXXyaNSfjipnR4AaABAg,6
2026-01-25 07:00:00,@ZaenalArifin-y5q,Antek Asing ..? Wah bikin Tempo deg degan nih... sampai bicaranya jadi Gagap...😂😂😂,0,UgzyYhjfdiqJNouMlkx4AaABAg,13
2026-01-25 07:00:00,@Guebebas1979,KALAU PEMERINTAH ATAU PIMPINAN NEGARA YG BIKIN PROPAGANDA GIMANA???😂😂😂,0,UgyDGhN_sZ15ymfl-z94AaABAg,9
2026-01-25 07:00:00,@rainbowteam1327,Jadi si omon omon itu halu sih menurut saya 😅,0,UgyAH4tsG68lL38sqNV4AaABAg,10
2026-01-25 07:00:00,@eddykof8958,Sekarang lagi ke eropa benuanya antek asing dan disuruh pidato disana 😂,0,UgyEG8AsZ7CMEfEaspZ4AaABAg,12
2026-01-25 07:00:00,@atikamarhamah2249,Mengerikan,0,UgzgwDpzZLaPrQZTcBd4AaABAg,1
2026-01-25 07:00:00,@ArgaTejaSukma,"TIDAK ADA PRESIDEN INDONESIA YG JAHAT, YG ADA ADALAH POLITIK YG BUSUK DAN PARTAI POLITIK YG LEBIH BUSUK ! 😮",0,Ugw2pSwJBTxhjd2m7D94AaABAg,20
2026-01-25 07:00:00,@santoswinarso58,"Konsep nasionalis yang disampaikan hanyalah utopis. Narasi dan label 'antek asing' adalah kosa kata lama yang selalu dieksplorasi mereka yang takut dikritik. Nasionalis, demokratis selalu muncul untuk labelisasi dan stigmatisasi antara 'us' dan 'them', 'we' dan 'they', antagonis dan protagonis...",0,Ugzrn07ylNSvJNe_X5J4AaABAg,40
2026-01-25 07:00:00,@dindaayu3305,Antek  Aseng  / Ngiseng😂,0,Ugy5Wl5cyupRFFsNabt4AaABAg,4
2026-01-25 07:00:00,@ArgaTejaSukma,"MUSUH YG PALING BERBAHAYA BAGI BANGSA DAN NEGARA INDONESIA BUKAN NEGARA LAIN, BUKAN PULA AS ATAU ISRAEL, TAPI BANGSA. MEREKALAH PARA PENGKHIANAT YG BERSEDIA MELAKUKAN APA SAJA DEMI NAFSU PRIBADI MAU PUN KELOMPOK  😮😮",0,UgwGEXuIhgfiO7qcDWV4AaABAg,34
2026-01-25 07:00:00,@MrBambang1979,Yang jelas-jelas ketemu sama cucunya Rockefeller kan Mbah wowo😅 jadi yang antek asing siapa?????,0,UgySoYtTinBUnYrT9qZ4AaABAg,14
2026-01-25 07:00:00,@edyprasetyo30,Media tempe baca peliharaan George soross wkwkwk,0,UgwJmlV3woLxITUXywt4AaABAg,7
2026-01-25 07:00:00,@TraxBeta,parbowo sebenernya engga salah kok... yang salah adalah itu antek2 semua temen dia jd cm koar2 g diapa2in,0,Ugxnqqqtwx0NJ6361Gp4AaABAg,18
2026-01-25 07:00:00,@agungsetiawan-c4u,bukan kah beliau sejak kecil hidup di luar negeri karena bapaknya kabur setelah kolab ama CIA buat berontak?,0,UgwCN43tUhInnyPlmlt4AaABAg,18
2026-01-25 07:00:00,@iprasnet,Menciptakan musuh bersama tapi musuh masyarakat dipelihara :face-blue-smiling:,1,Ugxi-inrzwWopL6IPpl4AaABAg,8
2026-01-25 07:00:00,@joys_C07,"Nuduh Antek asing,tapi gak malu masih berhutang ke b
Negara asing...!😅",1,Ugwe0h1PQJaZwM7QNzx4AaABAg,11
2026-01-25 07:00:00,@IjazahS1,"Semakin banyak UU di suatu negara, semakin menunjukan bahwa pemerintahnya OTORITER dan KORUP",0,UgyRGZlWEJQigi4iyNJ4AaABAg,13
2026-01-25 07:00:00,@DanielAchmad-e2i,Wowo penghamba antek asing buktinya ke luar negeri terus,0,UgwVkhTGxdf4pMXJegB4AaABAg,9
2026-01-25 07:00:00,@Nebbulizer,"Dulu hantunya PKI,terorisme sekarang antek aseng.
Hantu-hantu musuh bersama ciptaan rezim",0,UgwvCLYOFR-VkkaJ34N4AaABAg,11
2026-01-25 07:00:00,@alfarainfarming5573,Termasuk media ini anteknya,0,UgxWgtwnCOg-T2otBmh4AaABAg,4
2026-01-25 07:00:00,@tiosaputroo,"Heyy, ant take ant take ash sing 😀😀",0,UgyDbT4gx6MpGkQyo-N4AaABAg,8
2026-01-25 07:00:00,@wargakonoha12,"Mantap banget Prabowo ya.. ternyata 11 12 dgn mertuanya..
GPP KLO ini di sahkan RUu itu asal kalian para pejabat bnr2 bekerja demi kemajuan rakyat negara ini..tp KLO ini tujuannya hanya untuk memperkaya jajaran kalian saja maka jgn salahkn akan ada yg memberontak..",0,Ugxhjat7SbttFePfDq14AaABAg,43
2026-01-25 07:00:00,@rakyatbingung3145,Plot Twistnya.. Ternyata Antek Asing itu adalah orang yang mau menyelamatkan bangsa indonesia dari PEMBODOHAN Pemerintah..,0,UgwmvJlVub_REyKelNt4AaABAg,16
2026-01-25 07:00:00,@KisworoSutejo,antek asingnya... dinasti pak mul,0,Ugxk6FhXHjDKUl8mSwV4AaABAg,5
2026-01-25 07:00:00,@Putrawijaya-o3v,Keluarga jokowi yg paling marah ketika israel ngga jadi menyanyikan lagu kebangsaannya di nusantara😎,0,Ugzrh3MZYNeoghd6xYJ4AaABAg,14
2026-01-25 07:00:00,@ArieCiprong,Tak kira macan ternyata hanya kucing garong yg gemoy 😅😅😅,0,UgwY8riJptPKr4VfMcB4AaABAg,10
2026-01-25 07:00:00,@BambangPrihambodo,Musuh bersama itu jokowi !!,0,Ugx5gepDNgzjw75pIpF4AaABAg,5
2026-01-25 07:00:00,@spekterum,"Semua pembatasan pembatasan yang dibuat oleh pemerintah menunjukkan personel2 pemerintah memiliki kecerdasan yang rendah, tidak memiliki daya argumentasi, kemungkinan lulusan2 sarjana palsu, tidak paham perkembangan dan tuntutan jaman yang selalu berubah...halah maksudnya tolol semua...",0,UgzmLBr-u0i8nsjStvh4AaABAg,34
2026-01-25 07:00:00,@sumarnosumarno1117,😂😂😂😂 HIDUP JOKOWI.....HIDUP JOKOWII.....HIDUP JOKOWIIIIIII......OK GAS K GAS OK GAS JOGETIN AJE,0,UgzgHZzrmrSom9rOSox4AaABAg,12
2026-01-25 07:00:00,@liesandy291,Benci asing tapi masih mau investasi asing.,0,Ugwe0imW2YUYYbmJ8bZ4AaABAg,7
2026-01-25 07:00:00,@MmaiwanMohammad,Prabowo justru antek asing,0,UgyRkoH93AivvjCwOE54AaABAg,4
2026-01-25 07:00:00,@imungsyaiful3932,"Untuk jadi antek asing harus bayar 16,9 T?",0,UgwNvBlJUy1aSrMbe4V4AaABAg,8
2026-01-25 07:00:00,@pamacell1102,"TANGKAP ANTEK ASING. SIAPA ANTEK ASING? JKW, LBP, WOWO DLL.",0,Ugz_AZ-95JI98erk1Gt4AaABAg,10
2026-01-25 07:00:00,@Nengnining-x4y,Pejabat² lupa bahwa mereka yg sedang menyiksa rakyatnya,3,Ugxs9fXAf_NZj5sKftF4AaABAg,8
2026-01-25 07:00:00,@ereinaldy20,"yg di atas makin ga jelas kerjanya . kenapa ga ada yg demo lagi kayak kemarin ? ini udah berturut turut kabar kabar ga enak.. bahkan ekonomi kita ga ad perubahaan. masalah guru honorer aja kgk di lirik, malah jadiin MBG  naik PPPK.. aneh sumpah",0,UgzkHWPJ7KwyI3l8lNx4AaABAg,45
2026-01-25 07:00:00,@agussalim-yv6gp,Lebih bahaya anteknya Mulyono,0,UgxmIJqKBfALprun0md4AaABAg,4
2026-01-25 07:00:00,@ZedCoker8714,"""HEY ANTEK2 ASING!!!""
""NDIASMU"" 😂😂😂

~Mr. Presindent~",0,Ugz8PilEcD-JdeHD_r54AaABAg,7
2026-01-25 07:00:00,@MmaiwanMohammad,"Wapres otaknya kosong, nggak usah diajak rapat. Suruh tidur minum oplosan apa kek😅",0,UgwTe9QejyeI8WzYPVN4AaABAg,13
2026-01-25 07:00:00,@fitnusliknus552,Mirip propaganda PKI oleh mertua,0,Ugz6mmA3757AmDZzU6N4AaABAg,5
2026-01-25 07:00:00,@MmaiwanMohammad,"Di bawah wowo, arah kebijakan negara semakin ngaco...waspadai kebangkitan fasisme",0,UgwgbEan-pSer4qUyxx4AaABAg,10
2026-01-25 07:00:00,@sumartonotono2729,"Oligarki menyewa hati para pejabat yang gila harta, dengan dana yang jumbo. 
Hingga pejabat rela menjadi pengkhianat negara demi harta, maka jagalah hati par pejabat dari kemilaunya harta  !",0,UgyUSMGTvtzJeCpdcjB4AaABAg,29
2026-01-25 07:00:00,@setyobudiono8355,Omon2 hapalan bisanya antek asing😂,0,UgwxS9gBoWIkNCvTYct4AaABAg,5
